lemma (V),sentence,verb index,verb text,dobj,dobj index,truncated sent,replacement sentences,sentence similarity,token similarity
eat,"After the game i headed back to my parents to pick up my cat, angie, eat a little something and then head back home again.",17,eat,something,20,"After the game i headed back to my parents to pick up my cat, angie, eat a little","['After the game i headed back to my parents to pick up my cat, angie, eat a little bit', 'After the game i headed back to my parents to pick up my cat, angie, eat a little lunch', 'After the game i headed back to my parents to pick up my cat, angie, eat a little breakfast', 'After the game i headed back to my parents to pick up my cat, angie, eat a little snack', 'After the game i headed back to my parents to pick up my cat, angie, eat a little more food']",0.9936473965644836,0.44245526825173465
eat,Ever since starting to go to the gym (and quitting smoking) i've had an incredible urge to eat a shitload.,20,eat,shitload,22,Ever since starting to go to the gym (and quitting smoking) i've had an incredible urge to eat a,"[""Ever since starting to go to the gym (and quitting smoking) i've had an incredible urge to eat a lot"", ""Ever since starting to go to the gym (and quitting smoking) i've had an incredible urge to eat a large meal"", ""Ever since starting to go to the gym (and quitting smoking) i've had an incredible urge to eat a huge burger"", ""Ever since starting to go to the gym (and quitting smoking) i've had an incredible urge to eat a meal"", ""Ever since starting to go to the gym (and quitting smoking) i've had an incredible urge to eat a burger""]",0.9068212509155273,0.41442216679607913
eat,Now i think i'll eat a pizza and watch the first volume again.,5,eat,pizza,7,Now i think i'll eat a,"[""Now i think i'll eat a chicken"", ""Now i think i'll eat a lot"", ""Now i think i'll eat a banana"", ""Now i think i'll eat a piece"", ""Now i think i'll eat a good meal""]",0.5656512975692749,0.5725364091524517
eat,"Now since i don't like eating fish, i strictly practice catch and release.",6,eating,fish,7,Now since i don't like eating,"[""Now since i don't like eating meat"", ""Now since i don't like eating the food"", ""Now since i don't like eating food"", ""Now since i don't like eating junk food"", ""Now since i don't like eating a lot""]",0.7314267158508301,0.6178810254342403
eat,So that gave me some time to eat a little something-something and check the newsgroups online to see if there was anything good.,7,eat,something,10,So that gave me some time to eat a little,"['So that gave me some time to eat a little bit', 'So that gave me some time to eat a little food']",0.9716038703918457,0.44245526825173465
eat,"So i got back home, ate a small lunch, played with my cat for a little while, opened some more windows and then got back on my bike.",6,ate,lunch,9,"So i got back home, ate a small","['So i got back home, ate a small lunch', 'So i got back home, ate a small meal', 'So i got back home, ate a small dinner', 'So i got back home, ate a small snack', 'So i got back home, ate a small breakfast']",1.0000001192092896,1.0
eat,"The rest of the evening was spent talking to gash on the phone (really wasn't worth the time...something about cat scat), eating a crapload of food, and finally getting back to ripping more of my cds.",27,eating,crapload,29,"The rest of the evening was spent talking to gash on the phone (really wasn't worth the time...something about cat scat), eating a","[""The rest of the evening was spent talking to gash on the phone (really wasn't worth the time...something about cat scat), eating a lot"", ""The rest of the evening was spent talking to gash on the phone (really wasn't worth the time...something about cat scat), eating a tasty meal"", ""The rest of the evening was spent talking to gash on the phone (really wasn't worth the time...something about cat scat), eating a bunch"", ""The rest of the evening was spent talking to gash on the phone (really wasn't worth the time...something about cat scat), eating a cake"", ""The rest of the evening was spent talking to gash on the phone (really wasn't worth the time...something about cat scat), eating a snack""]",0.9778649806976318,0.24925226206230727
eat,"After either of those is done, then i'm ready to eat a big fucking dinner and then my body goes into what i call 'i'm not fucking moving anymore' mode.",12,eat,dinner,16,"After either of those is done, then i'm ready to eat a big fucking","[""After either of those is done, then i'm ready to eat a big fucking casserole"", ""After either of those is done, then i'm ready to eat a big fucking sandwich"", ""After either of those is done, then i'm ready to eat a big fucking meal"", ""After either of those is done, then i'm ready to eat a big fucking steak"", ""After either of those is done, then i'm ready to eat a big fucking lunch""]",0.8603240251541138,0.45006369499488086
eat,"Of course that time was split in 20 mile increments from 11am-ish to 9pm, and i went to the golfing range and ate a big lunch in between.",26,ate,lunch,29,"Of course that time was split in 20 mile increments from 11am-ish to 9pm, and i went to the golfing range and ate a big","['Of course that time was split in 20 mile increments from 11am-ish to 9pm, and i went to the golfing range and ate a big bowl', 'Of course that time was split in 20 mile increments from 11am-ish to 9pm, and i went to the golfing range and ate a big breakfast', 'Of course that time was split in 20 mile increments from 11am-ish to 9pm, and i went to the golfing range and ate a big steak', 'Of course that time was split in 20 mile increments from 11am-ish to 9pm, and i went to the golfing range and ate a big meal', 'Of course that time was split in 20 mile increments from 11am-ish to 9pm, and i went to the golfing range and ate a big sandwich']",0.9105581045150757,0.29137032215419273
eat,"Wazeecha was a little wet and muddy, so now i'm going to have to hit the shower again before bed, but first i'm going to eat a whole cow or the equivalent if i can't find a cow to eat within the next 20 minutes.",29,eat,cow,32,"Wazeecha was a little wet and muddy, so now i'm going to have to hit the shower again before bed, but first i'm going to eat a whole","[""Wazeecha was a little wet and muddy, so now i'm going to have to hit the shower again before bed, but first i'm going to eat a whole box"", ""Wazeecha was a little wet and muddy, so now i'm going to have to hit the shower again before bed, but first i'm going to eat a whole bowl"", ""Wazeecha was a little wet and muddy, so now i'm going to have to hit the shower again before bed, but first i'm going to eat a whole tub"", ""Wazeecha was a little wet and muddy, so now i'm going to have to hit the shower again before bed, but first i'm going to eat a whole pizza"", ""Wazeecha was a little wet and muddy, so now i'm going to have to hit the shower again before bed, but first i'm going to eat a whole bunch""]",0.8517820835113525,0.12067197419225617
eat,Ate a nice sammich for lunch and then went out to a driving range with robert.,0,Ate,sammich,3,Ate a nice,"['Ate a nice burrito', 'Ate a nice dinner', 'Ate a nice burger', 'Ate a nice meal', 'Ate a nice sandwich']",0.6827540397644043,0.0926928413943491
eat,"We also ate the cancun restaurant, some mexican restaurant that opened not too long ago, and it was alright, but not good enough for the price.",2,ate,restaurant,5,We also ate the cancun,['We also ate the cancun'],0.8640263080596924,0.18481924744659425
eat,"They had their seafood buffet, which i had never had before, so we all dug in except for gash who just ate noodles of course.",23,ate,noodles,24,"They had their seafood buffet, which i had never had before, so we all dug in except for gash who just ate","['They had their seafood buffet, which i had never had before, so we all dug in except for gash who just ate up the whole thing', 'They had their seafood buffet, which i had never had before, so we all dug in except for gash who just ate his shrimp', 'They had their seafood buffet, which i had never had before, so we all dug in except for gash who just ate his meal', 'They had their seafood buffet, which i had never had before, so we all dug in except for gash who just ate his food', 'They had their seafood buffet, which i had never had before, so we all dug in except for gash who just ate some chips']",0.9243927001953125,0.2267979317787663
eat,"They had some squid there and i had just watched a show a short time ago about the different ways people eat squid over in japan, so i thought 'what the fuck, let's try it' and slapped a big helping of tentacles and whatever else was in that dish on my plate.",21,eat,squid,22,They had some squid there and i had just watched a show a short time ago about the different ways people eat,"['They had some squid there and i had just watched a show a short time ago about the different ways people eat squid', 'They had some squid there and i had just watched a show a short time ago about the different ways people eat their food']",1.0000001192092896,1.0
eat,"I still won't eat oysters, but i'll eat squid (cooked) again any day.",4,eat,oysters,5,I still won't eat,"[""I still won't eat fish"", ""I still won't eat meat"", ""I still won't eat the meat"", ""I still won't eat ice cream"", ""I still won't eat an avocado""]",0.7463719844818115,0.6888477622441999
eat,"I still won't eat oysters, but i'll eat squid (cooked) again any day.",10,eat,squid,11,"I still won't eat oysters, but i'll eat","[""I still won't eat oysters, but i'll eat more seafood"", ""I still won't eat oysters, but i'll eat my veggies"", ""I still won't eat oysters, but i'll eat the whole thing"", ""I still won't eat oysters, but i'll eat my chocolate"", ""I still won't eat oysters, but i'll eat prawns""]",0.8685789108276367,0.41621219642698853
eat,"it just makes sense to have it every week.. to me it ultimately builds up my faith in this interesting way, that i'm encouraged that the gates of hell have not prevailed against the gospel and the truth, because i'm right here doing this, eating this holy meal along with saints for two thousand years..",50,eating,meal,53,"it just makes sense to have it every week.. to me it ultimately builds up my faith in this interesting way, that i'm encouraged that the gates of hell have not prevailed against the gospel and the truth, because i'm right here doing this, eating this holy","[""it just makes sense to have it every week.. to me it ultimately builds up my faith in this interesting way, that i'm encouraged that the gates of hell have not prevailed against the gospel and the truth, because i'm right here doing this, eating this holy bread"", ""it just makes sense to have it every week.. to me it ultimately builds up my faith in this interesting way, that i'm encouraged that the gates of hell have not prevailed against the gospel and the truth, because i'm right here doing this, eating this holy shit"", ""it just makes sense to have it every week.. to me it ultimately builds up my faith in this interesting way, that i'm encouraged that the gates of hell have not prevailed against the gospel and the truth, because i'm right here doing this, eating this holy stuff"", ""it just makes sense to have it every week.. to me it ultimately builds up my faith in this interesting way, that i'm encouraged that the gates of hell have not prevailed against the gospel and the truth, because i'm right here doing this, eating this holy food"", ""it just makes sense to have it every week.. to me it ultimately builds up my faith in this interesting way, that i'm encouraged that the gates of hell have not prevailed against the gospel and the truth, because i'm right here doing this, eating this holy delicious food""]",0.9810076951980591,0.5376151054619787
eat,"ok ok, eat poop, sleep and pee.",3,eat,poop,4,"ok ok, eat","['ok ok, eat something', 'ok ok, eat the apple', 'ok ok, eat the cake']",0.7002992033958435,0.14170589710573742
eat,"Blogger is being very buggy right now, refusing to let me edit my template, and then actually eating the entire text of an entry i was about to put up.",19,eating,text,22,"Blogger is being very buggy right now, refusing to let me edit my template, and then actually eating the entire","['Blogger is being very buggy right now, refusing to let me edit my template, and then actually eating the entire thing', 'Blogger is being very buggy right now, refusing to let me edit my template, and then actually eating the entire article', 'Blogger is being very buggy right now, refusing to let me edit my template, and then actually eating the entire page', 'Blogger is being very buggy right now, refusing to let me edit my template, and then actually eating the entire folder', 'Blogger is being very buggy right now, refusing to let me edit my template, and then actually eating the entire post']",0.9639372825622559,0.23028105080902178
eat,she's prob having the time of her life eating mountains of sushi and sashimi while we're here suffering...,9,eating,mountains,10,she's prob having the time of her life eating,"[""she's prob having the time of her life eating ice cream"", ""she's prob having the time of her life eating a cake"", ""she's prob having the time of her life eating that whole thing"", ""she's prob having the time of her life eating these amazing sandwiches"", ""she's prob having the time of her life eating these delicious meals""]",0.6988606452941895,0.19509122749465574
eat,i dreamt that i was eating something which i forgot and bit my tongue in my sleep...,5,eating,something,6,i dreamt that i was eating,"['i dreamt that i was eating the meat', 'i dreamt that i was eating some kind', 'i dreamt that i was eating a meal', 'i dreamt that i was eating cookies', 'i dreamt that i was eating a big meal']",0.81034916639328,0.29440048850387907
eat,ok gonna eat lunch now so...see ya suckers!!,3,eat,lunch,4,ok gonna eat,"['ok gonna eat a baby', 'ok gonna eat my face', 'ok gonna eat your face', 'ok gonna eat that face', 'ok gonna eat the whole lot']",0.5000797510147095,0.23704385201931422
eat,:p  woke up at 8am today.. ate breakfast (muesli with sliced bananas and milk) and proceeded to watch a little of the tapes me and my brother borrowed from the library..,9,ate,breakfast,10,:p  woke up at 8am today.. ate,"[':p  woke up at 8am today.. ate breakfast', ':p  woke up at 8am today.. ate a lot', ':p  woke up at 8am today.. ate lunch', ':p  woke up at 8am today.. ate 2kk calories', ':p  woke up at 8am today.. ate some breakfast']",1.0,1.0
eat,then we went to swim for 1/2h ..came back.. ate lunch( spicy fried rice) and the tobelrone chocs... watched a little of the japan 'tv champion' ..,11,ate,lunch,12,then we went to swim for 1/2h ..came back.. ate,"['then we went to swim for 1/2h ..came back.. ate lunch', 'then we went to swim for 1/2h ..came back.. ate some lunch', 'then we went to swim for 1/2h ..came back.. ate a lot', 'then we went to swim for 1/2h ..came back.. ate dinner', 'then we went to swim for 1/2h ..came back.. ate some rice']",1.0,1.0
eat,Did i mention that i didn't eat any dinner?,7,eat,dinner,9,Did i mention that i didn't eat any,"[""Did i mention that i didn't eat any food"", ""Did i mention that i didn't eat any carbs"", ""Did i mention that i didn't eat any meat"", ""Did i mention that i didn't eat any breakfast"", ""Did i mention that i didn't eat any fish""]",0.8504446148872375,0.3449764556903774
eat,I ate way too much food and then we hung out at m and j's place.,1,ate,food,5,I ate way too much,['I ate way too much pizza'],0.8267810344696045,0.46639817930773697
eat,So i crossed the bridge and ate a deee-licious salsa omelet at  urllink kate's kitchen  and then somehow ended up spending the rest of the day in the city.,6,ate,omelet,12,So i crossed the bridge and ate a deee-licious salsa,"['So i crossed the bridge and ate a deee-licious salsa', 'So i crossed the bridge and ate a deee-licious salsa sandwich', 'So i crossed the bridge and ate a deee-licious salsa salad', 'So i crossed the bridge and ate a deee-licious salsa verde']",0.9000614285469055,0.43354625903759936
eat,"This saturday was a day to relax, alex and i got up at 10:30, ate breakfast, read the paper, gave the cat a bath (okay, maybe that wasn't too relaxing), and then did some window shopping.",16,ate,breakfast,17,"This saturday was a day to relax, alex and i got up at 10:30, ate","['This saturday was a day to relax, alex and i got up at 10:30, ate dinner', 'This saturday was a day to relax, alex and i got up at 10:30, ate lunch', 'This saturday was a day to relax, alex and i got up at 10:30, ate breakfast', 'This saturday was a day to relax, alex and i got up at 10:30, ate a good breakfast', 'This saturday was a day to relax, alex and i got up at 10:30, ate a lot']",0.9720122218132019,0.74703299414339
eat,"Rm and greg came over later on and we drank wine, played games and ate chinese food.",15,ate,food,17,"Rm and greg came over later on and we drank wine, played games and ate chinese","['Rm and greg came over later on and we drank wine, played games and ate chinese food']",1.0,1.0
eat,Although i haven't eaten an actual piece i probably ingested about 3000 calories of raw ingredients while i was making it.,4,eaten,piece,7,Although i haven't eaten an actual,"[""Although i haven't eaten an actual meal"", ""Although i haven't eaten an actual food"", ""Although i haven't eaten an actual apple"", ""Although i haven't eaten an actual, healthy meal"", ""Although i haven't eaten an actual piece""]",0.6902691721916199,0.2105980685391283
eat,That will make it virtually impossible for me to ever eat a slice because i'll be thoroughly disgusted by the idea of this pie by around 9:00 tonight.,10,eat,slice,12,That will make it virtually impossible for me to ever eat a,"['That will make it virtually impossible for me to ever eat a piece', 'That will make it virtually impossible for me to ever eat a gluten-free diet', 'That will make it virtually impossible for me to ever eat a dog', 'That will make it virtually impossible for me to ever eat a healthy, raw vegan diet', 'That will make it virtually impossible for me to ever eat a good steak']",0.8425220251083374,0.49154222046875384
eat,"Don't look at it if you ate the pie, because you'll never want to eat it again.",7,ate,pie,9,Don't look at it if you ate the,"[""Don't look at it if you ate the same food"", ""Don't look at it if you ate the last bag"", ""Don't look at it if you ate the meat"", ""Don't look at it if you ate the whole thing"", ""Don't look at it if you ate the first one""]",0.6391456723213196,0.24044803666766273
eat,I couldn't believe i didn't eat lunch.,7,eat,lunch,8,I couldn't believe i didn't eat,"[""I couldn't believe i didn't eat a damn thing"", ""I couldn't believe i didn't eat the entire thing"", ""I couldn't believe i didn't eat all that food"", ""I couldn't believe i didn't eat any vegetables"", ""I couldn't believe i didn't eat all my food""]",0.8189647197723389,0.19776061278884557
eat,So instead i just pushed all the cheetos to the furthest corner of the stall because he really shouldn't eat those things off the floor.,20,eat,things,22,So instead i just pushed all the cheetos to the furthest corner of the stall because he really shouldn't eat those,"[""So instead i just pushed all the cheetos to the furthest corner of the stall because he really shouldn't eat those things""]",0.9999998807907104,1.0
eat,So now i will go and eat my fatty-fatty-fat-fat burger and fries and numb my brain with the wonders of television.,6,eat,burger,15,So now i will go and eat my fatty-fatty-fat-fat,[],-1.0,-1.0
eat,"I do however recall that they had a pretty kick ass habitral (though nothing compared to  urllink these )and that they ate their babies, or maybe they ate each other, it's a little blurry when it comes to who was eating who.",24,ate,babies,26,I do however recall that they had a pretty kick ass habitral (though nothing compared to  urllink these )and that they ate their,"['I do however recall that they had a pretty kick ass habitral (though nothing compared to  urllink these )and that they ate their food', 'I do however recall that they had a pretty kick ass habitral (though nothing compared to  urllink these )and that they ate their meals', 'I do however recall that they had a pretty kick ass habitral (though nothing compared to  urllink these )and that they ate their fill', 'I do however recall that they had a pretty kick ass habitral (though nothing compared to  urllink these )and that they ate their lunch', 'I do however recall that they had a pretty kick ass habitral (though nothing compared to  urllink these )and that they ate their fruit']",0.9066612720489502,0.2510781116330145
eat,"During undergrad i went into my 'i'm cool and alternative' phase which led to ownership of a pet snake, who i promptly gave away to a grade school when she got big enough to eat rats.",38,eat,rats,39,"During undergrad i went into my 'i'm cool and alternative' phase which led to ownership of a pet snake, who i promptly gave away to a grade school when she got big enough to eat","[""During undergrad i went into my 'i'm cool and alternative' phase which led to ownership of a pet snake, who i promptly gave away to a grade school when she got big enough to eat my hands"", ""During undergrad i went into my 'i'm cool and alternative' phase which led to ownership of a pet snake, who i promptly gave away to a grade school when she got big enough to eat kibble"", ""During undergrad i went into my 'i'm cool and alternative' phase which led to ownership of a pet snake, who i promptly gave away to a grade school when she got big enough to eat the chicken"", ""During undergrad i went into my 'i'm cool and alternative' phase which led to ownership of a pet snake, who i promptly gave away to a grade school when she got big enough to eat my lunch"", ""During undergrad i went into my 'i'm cool and alternative' phase which led to ownership of a pet snake, who i promptly gave away to a grade school when she got big enough to eat my cereal box""]",0.9887334108352661,0.16446165131355162
eat,"Even though thoughts of the work project kept gnawing in the back of my head i had a nice time at both events, i got to spend time with almost all my friends and eat some pretty great food.",35,eat,food,39,"Even though thoughts of the work project kept gnawing in the back of my head i had a nice time at both events, i got to spend time with almost all my friends and eat some pretty great","['Even though thoughts of the work project kept gnawing in the back of my head i had a nice time at both events, i got to spend time with almost all my friends and eat some pretty great food']",1.0000001192092896,1.0
eat,"Perfume lady was only having a vanilla latte, while her husband and child ate eggs, sausage, bacon and toast.",14,ate,eggs,15,"Perfume lady was only having a vanilla latte, while her husband and child ate","['Perfume lady was only having a vanilla latte, while her husband and child ate their dinner', 'Perfume lady was only having a vanilla latte, while her husband and child ate a bowl', 'Perfume lady was only having a vanilla latte, while her husband and child ate cake', 'Perfume lady was only having a vanilla latte, while her husband and child ate chocolate', 'Perfume lady was only having a vanilla latte, while her husband and child ate a salad']",0.9247756004333496,0.2620834863929812
eat,We ate some grilly kind of foods and played some games.,1,ate,foods,6,We ate some grilly kind of,"['We ate some grilly kind of chicken', 'We ate some grilly kind', 'We ate some grilly kind of vegetables', 'We ate some grilly kind of beef']",0.8687012195587158,0.5054611650311928
eat,I even ate lunch at my desk.,2,ate,lunch,3,I even ate,"['I even ate a bunch', 'I even ate a banana', 'I even ate a lot', 'I even ate a large handful', 'I even ate a bit']",0.5889261960983276,0.3132103664555805
eat,We ate a lot of popcorn.,1,ate,lot,3,We ate a,"['We ate a lot', 'We ate a bowl']",1.0,1.0
eat,Today i woke up with a vision of reading the paper while sipping my coffee and eating a nice breakfast.,16,eating,breakfast,19,Today i woke up with a vision of reading the paper while sipping my coffee and eating a nice,"['Today i woke up with a vision of reading the paper while sipping my coffee and eating a nice soft oatmeal', 'Today i woke up with a vision of reading the paper while sipping my coffee and eating a nice breakfast', 'Today i woke up with a vision of reading the paper while sipping my coffee and eating a nice sunny morning coffee', 'Today i woke up with a vision of reading the paper while sipping my coffee and eating a nice bowl', 'Today i woke up with a vision of reading the paper while sipping my coffee and eating a nice chocolate cake']",0.9207577705383301,0.6202434195960232
eat,"De la soul ,  urllink ll cool j  (so forget oreos, eat cool j cookies, hes baaaad!), and  urllink mc lyte  (doin her thing with an '89 swing).",15,eat,cookies,18,"De la soul ,  urllink ll cool j  (so forget oreos, eat cool j","['De la soul ,  urllink ll cool j  (so forget oreos, eat cool j']",0.9839159250259399,0.23126766886705374
eat,"At any rate we're eating hot dogs, drinking beer, and i get to sit on the front stoop and write this, so at least we're having a good time.",5,eating,dogs,7,At any rate we're eating hot,"[""At any rate we're eating hot dogs"", ""At any rate we're eating hot chocolate"", ""At any rate we're eating hotdogs""]",1.0,1.0
