lemma (V),sentence,verb index,verb text,dobj,dobj index,truncated sent,replacement sentences,sentence similarity,token similarity
eat,Who wants to huddle together underground eating canned spam?,6,eating,spam,8,Who wants to huddle together underground eating canned,"['Who wants to huddle together underground eating canned beans', 'Who wants to huddle together underground eating canned tuna', 'Who wants to huddle together underground eating canned food', 'Who wants to huddle together underground eating canned peas', 'Who wants to huddle together underground eating canned soup']",0.8256231546401978,0.0458452096043396
eat,"(safety note: concentrated hydrofluoric acid is so corrosive that it will eat its way through glass, so store it only in plastic.",13,eat,way,15,(safety note: concentrated hydrofluoric acid is so corrosive that it will eat its,['(safety note: concentrated hydrofluoric acid is so corrosive that it will eat its way'],1.0,1.0
eat,If you eat too many bananas you'll get a stomach-ache.,2,eat,bananas,5,If you eat too many,"['If you eat too many food items', 'If you eat too many bananas', 'If you eat too many cookies', 'If you eat too many carbs', 'If you eat too many eggs']",0.6562490463256836,0.288195178276404
eat,"#10 many koreans have dogs as pets, but many other koreans eat dog!",13,eat,dog,14,"#10 many koreans have dogs as pets, but many other koreans eat","['#10 many koreans have dogs as pets, but many other koreans eat dogs', '#10 many koreans have dogs as pets, but many other koreans eat only their pets', '#10 many koreans have dogs as pets, but many other koreans eat dog meat', '#10 many koreans have dogs as pets, but many other koreans eat meat', '#10 many koreans have dogs as pets, but many other koreans eat cats']",0.99748694896698,0.8334001545152038
eat,"Yup,  urllink they eat dogs here (read story if you've got a strong stomach) .",5,eat,dogs,6,"Yup,  urllink they eat","['Yup,  urllink they eat the shit', 'Yup,  urllink they eat the same shit', 'Yup,  urllink they eat your soul', 'Yup,  urllink they eat a lotFresh meat', 'Yup,  urllink they eat shit']",0.8691508173942566,0.21908019610093976
eat,"In the summer months people even sleep next to the river (well, not  right  next to it) fishing, eating ramen, drinking soju, talking...typical korean stuff.",24,eating,ramen,25,"In the summer months people even sleep next to the river (well, not  right  next to it) fishing, eating","['In the summer months people even sleep next to the river (well, not  right  next to it) fishing, eating the fish', 'In the summer months people even sleep next to the river (well, not  right  next to it) fishing, eating fish']",0.9237686395645142,0.2972672711368337
eat,"One scene is with these 3 minor gangsters who are so poor they have to eat dogfood, but it gives them the runs and later (when you least expect it) a serious scene cuts to them running into a single-stall public loo.",15,eat,dogfood,16,One scene is with these 3 minor gangsters who are so poor they have to eat,"['One scene is with these 3 minor gangsters who are so poor they have to eat the best food', 'One scene is with these 3 minor gangsters who are so poor they have to eat one meal', 'One scene is with these 3 minor gangsters who are so poor they have to eat the trash', 'One scene is with these 3 minor gangsters who are so poor they have to eat scraps', 'One scene is with these 3 minor gangsters who are so poor they have to eat their dinner']",0.925304651260376,0.8873342835053156
eat,I ate the spaghetti of the wall!,1,ate,spaghetti,3,I ate the,"['I ate the whole thing', 'I ate the leftovers', 'I ate the last half', 'I ate the last steak', 'I ate the same thing']",0.5810562372207642,0.19931104411594447
eat,The teachers din bother to stop us from eating sweets in class.,8,eating,sweets,9,The teachers din bother to stop us from eating,"['The teachers din bother to stop us from eating the food', 'The teachers din bother to stop us from eating our lunch']",0.8427432775497437,0.5307930136564302
eat,"i simply love fruits lor..today they wanted to go foodcourt 6, den we go lor..there got no food to eat lor..all not appealing..so fruits is just the best solution.",24,eat,lor,25,"i simply love fruits lor..today they wanted to go foodcourt 6, den we go lor..there got no food to eat",[],-1.0,-1.0
eat,wads wrong with eating tomato! heck la..den we left first..went co-op shop..damn lor..bought choc..but share..so not too bad.crunch.nice la..today class was from 9-6pm..but fruits still the best.,3,eating,tomato,4,wads wrong with eating,"['wads wrong with eating beef', 'wads wrong with eating a lot', 'wads wrong with eating the food', 'wads wrong with eating too much sugar', 'wads wrong with eating fish']",0.6231905221939087,0.5475476444989367
eat,and i can't take it.plus was also considering wad to eat tml..just to lose more weight.,11,eat,tml,12,and i can't take it.plus was also considering wad to eat,[],-1.0,-1.0
eat,i ate alot of fruits yesterday also.,1,ate,alot,2,i ate,"['i ate a little bit', 'i ate the doughnuts', 'i ate a banana', 'i ate a meal', 'i ate a few more slices']",0.5290226936340332,0.3496259470153001
eat,"i ate one grapefruit, 2 oranges, half a dragonfruit.",1,ate,grapefruit,3,i ate one,[],-1.0,-1.0
eat,den go school..haiya..same thing la..den hor..ate lunch at kfc..super sinful..,13,ate,lunch,14,den go school..haiya..same thing la..den hor..ate,"['den go school..haiya..same thing la..den hor..ate..the..toy', 'den go school..haiya..same thing la..den hor..ate d..hut']",0.8525437116622925,0.12076281263929606
eat,"i also duno why ask her to come..cos too late le..can't do anything much..so went fc4 to eat..she eat la..not me and mandy..after eat le den we from sp walk to clementi..went to mr bean to eat tang yuan..nice la..but fattening..got tangyuan, beancurd,soya milk and syrup..",35,eat,den,37,i also duno why ask her to come..cos too late le..can't do anything much..so went fc4 to eat..she eat la..not me and mandy..after eat le,[],-1.0,-1.0
eat,i ate 3 tangyuan den mandy help me eat the last one..den we take bus to eunos den from there take mrt..hai..slept on the bus..really too tired..,8,eat,one,11,i ate 3 tangyuan den mandy help me eat the last,"['i ate 3 tangyuan den mandy help me eat the last bits', 'i ate 3 tangyuan den mandy help me eat the last 3 dumplings', 'i ate 3 tangyuan den mandy help me eat the last half', 'i ate 3 tangyuan den mandy help me eat the last 3 tangyuan', 'i ate 3 tangyuan den mandy help me eat the last bit']",0.9564698934555054,0.24456124684895428
eat,"i've been eating soooooo much lor..since tue till today..genki sushi on tue, ljs+ice cream yesterday, den today kfc+tangyuan..cannot la..if this goes on, sure die de..but i duno",3,eating,lor,6,i've been eating soooooo much,"[""i've been eating soooooo much fruit"", ""i've been eating soooooo much peanut butter"", ""i've been eating soooooo much more cheese"", ""i've been eating soooooo much food"", ""i've been eating soooooo much pizza""]",0.7234449982643127,-0.011362551809676914
eat,"i say i didn't eat alot..eat fish soup, a lot of fruits..he say i cannot take oily food(i hate oily stuff, so fattening!), no milk(stopped drinking that too..fattening)..strange lor..how on earth did i get food poisoning!",5,eat,alot,6,i say i didn't eat,"[""i say i didn't eat the fruit"", ""i say i didn't eat the whole meal""]",0.5180213451385498,0.05270265875495765
eat,"i say i didn't eat alot..eat fish soup, a lot of fruits..he say i cannot take oily food(i hate oily stuff, so fattening!), no milk(stopped drinking that too..fattening)..strange lor..how on earth did i get food poisoning!",8,eat,soup,10,i say i didn't eat alot..eat fish,"[""i say i didn't eat alot..eat fish""]",0.953693151473999,0.39562105478423876
eat,i and theo always eat watermelon..from same stall oso..,4,eat,watermelon,5,i and theo always eat,"['i and theo always eat the same thing', 'i and theo always eat the same meal', 'i and theo always eat the same food']",0.7547073364257812,0.33478365842020397
eat,cos i only haven't been eating carbo for like 1 week...,6,eating,carbo,7,cos i only haven't been eating,"[""cos i only haven't been eating much meat"", ""cos i only haven't been eating the meat"", ""cos i only haven't been eating the food""]",0.7122132778167725,0.39497621078183826
eat,really cmi la..  stay at home only can rot..i tried eating today..din vomit.but super bloated..mabbe cos of the ribena..wanna die liao..my last meal was at 10+am..but till now not hungry at all..i wanted to eat watermelon..but dropped it..there goes my fruit.,50,eat,watermelon,51,really cmi la..  stay at home only can rot..i tried eating today..din vomit.but super bloated..mabbe cos of the ribena..wanna die liao..my last meal was at 10+am..but till now not hungry at all..i wanted to eat,"['really cmi la..  stay at home only can rot..i tried eating today..din vomit.but super bloated..mabbe cos of the ribena..wanna die liao..my last meal was at 10+am..but till now not hungry at all..i wanted to eat food', 'really cmi la..  stay at home only can rot..i tried eating today..din vomit.but super bloated..mabbe cos of the ribena..wanna die liao..my last meal was at 10+am..but till now not hungry at all..i wanted to eat lunch', 'really cmi la..  stay at home only can rot..i tried eating today..din vomit.but super bloated..mabbe cos of the ribena..wanna die liao..my last meal was at 10+am..but till now not hungry at all..i wanted to eat some food', ""really cmi la..  stay at home only can rot..i tried eating today..din vomit.but super bloated..mabbe cos of the ribena..wanna die liao..my last meal was at 10+am..but till now not hungry at all..i wanted to eat Mohammed's food"", 'really cmi la..  stay at home only can rot..i tried eating today..din vomit.but super bloated..mabbe cos of the ribena..wanna die liao..my last meal was at 10+am..but till now not hungry at all..i wanted to eat dinner']",0.9830013513565063,0.46551150544007536
eat,Yesterday ah..i was sick lor..duno why also..mabbe lack carbo..havent been eating carbo for a few days.,18,eating,carbo,19,Yesterday ah..i was sick lor..duno why also..mabbe lack carbo..havent been eating,['Yesterday ah..i was sick lor..duno why also..mabbe lack carbo..havent been eating a lot'],0.992690920829773,0.14020883173555132
eat,Didn't eat breakfast.,2,eat,breakfast,3,Didn't eat,"[""Didn't eat that last one"", ""Didn't eat the beans"", ""Didn't eat breakfast""]",0.503994345664978,0.2378233776561351
eat,"add to this the effects of returning to training after an extended bout of laziness, and we have a recipe for why i am only just surfacing now to eat the chocolate muffin left for me.",30,eat,muffin,33,"add to this the effects of returning to training after an extended bout of laziness, and we have a recipe for why i am only just surfacing now to eat the chocolate","['add to this the effects of returning to training after an extended bout of laziness, and we have a recipe for why i am only just surfacing now to eat the chocolate chip cookies', 'add to this the effects of returning to training after an extended bout of laziness, and we have a recipe for why i am only just surfacing now to eat the chocolate', 'add to this the effects of returning to training after an extended bout of laziness, and we have a recipe for why i am only just surfacing now to eat the chocolate cake', 'add to this the effects of returning to training after an extended bout of laziness, and we have a recipe for why i am only just surfacing now to eat the chocolate bars']",0.9283982515335083,0.36904482157480284
eat,plans for today: call evil car hire firm call non-evil laura eat non-evil food pay evil credit card bill maybe even go outside   the world is my (non-evil) lobster.,14,eat,food,18,plans for today: call evil car hire firm call non-evil laura eat non-evil,"['plans for today: call evil car hire firm call non-evil laura eat non-evil cookies', 'plans for today: call evil car hire firm call non-evil laura eat non-evil fruit', 'plans for today: call evil car hire firm call non-evil laura eat non-evil goshdarnit', 'plans for today: call evil car hire firm call non-evil laura eat non-evil food', 'plans for today: call evil car hire firm call non-evil laura eat non-evil dinner non-evil party non']",0.9526181221008301,0.3286385956810873
eat,"also, i have a friend who (i suspect) may need help eating that tub of ice cream...",14,eating,tub,16,"also, i have a friend who (i suspect) may need help eating that","['also, i have a friend who (i suspect) may need help eating that evening', 'also, i have a friend who (i suspect) may need help eating that way', 'also, i have a friend who (i suspect) may need help eating that cake']",0.4995384216308594,0.10366368276829516
eat,"the manchester cow parade   slaps: indigestion from eating toast and rice too quickly   (sheesh...)  and no, i'm *not* in a mood...  n.",9,eating,toast,10,the manchester cow parade   slaps: indigestion from eating,"['the manchester cow parade   slaps: indigestion from eating too much cheese', 'the manchester cow parade   slaps: indigestion from eating food', 'the manchester cow parade   slaps: indigestion from eating a slice', 'the manchester cow parade   slaps: indigestion from eating a lot', 'the manchester cow parade   slaps: indigestion from eating too much meat']",0.8513234853744507,0.5633501151525581
eat,five in the afternoon is not a good time to be eating breakfast.,11,eating,breakfast,12,five in the afternoon is not a good time to be eating,"['five in the afternoon is not a good time to be eating a big lunch', 'five in the afternoon is not a good time to be eating breakfast', 'five in the afternoon is not a good time to be eating junk food', 'five in the afternoon is not a good time to be eating dinner', 'five in the afternoon is not a good time to be eating a bacon sandwich']",0.8409010767936707,0.7939279027983289
eat,"oh, alright then, but she's done backing vocals with  urllink weezer  and jimmy eat world, and that's good enough for me.",18,eat,world,19,"oh, alright then, but she's done backing vocals with  urllink weezer  and jimmy eat","[""oh, alright then, but she's done backing vocals with  urllink weezer  and jimmy eat my ass"", ""oh, alright then, but she's done backing vocals with  urllink weezer  and jimmy eat shit"", ""oh, alright then, but she's done backing vocals with  urllink weezer  and jimmy eat dirt"", ""oh, alright then, but she's done backing vocals with  urllink weezer  and jimmy eat my shorts""]",0.9704671502113342,0.0012704589489378978
eat,"other news is that the solid block of sugar that has been threatening to fall out of my sugar tin finally did so into one the most enjoyable cups of coffee i've had in a while, i am almost out of maple syrup on account of eating popcorn for most meals, and i have been thinking about happiness some more.",48,eating,popcorn,49,"other news is that the solid block of sugar that has been threatening to fall out of my sugar tin finally did so into one the most enjoyable cups of coffee i've had in a while, i am almost out of maple syrup on account of eating","[""other news is that the solid block of sugar that has been threatening to fall out of my sugar tin finally did so into one the most enjoyable cups of coffee i've had in a while, i am almost out of maple syrup on account of eating so many maple-sugar"", ""other news is that the solid block of sugar that has been threatening to fall out of my sugar tin finally did so into one the most enjoyable cups of coffee i've had in a while, i am almost out of maple syrup on account of eating a lot"", ""other news is that the solid block of sugar that has been threatening to fall out of my sugar tin finally did so into one the most enjoyable cups of coffee i've had in a while, i am almost out of maple syrup on account of eating a bag"", ""other news is that the solid block of sugar that has been threatening to fall out of my sugar tin finally did so into one the most enjoyable cups of coffee i've had in a while, i am almost out of maple syrup on account of eating the whole tin"", ""other news is that the solid block of sugar that has been threatening to fall out of my sugar tin finally did so into one the most enjoyable cups of coffee i've had in a while, i am almost out of maple syrup on account of eating lots""]",0.967215895652771,0.4195200259023577
eat,I'm at work eating lunch right now.,4,eating,lunch,5,I'm at work eating,"[""I'm at work eating my lunch"", ""I'm at work eating a hot dog"", ""I'm at work eating my own vegetables"", ""I'm at work eating the most delicious sandwiches"", ""I'm at work eating a sandwich""]",0.9747765064239502,1.0
eat,"I did something, ate dinner, blaa blaa for the next few hours untill it was almost time for bed.",4,ate,dinner,5,"I did something, ate","['I did something, ate a pizza']",0.7606387138366699,0.5379820731251566
eat,"Anyways, am eating butter and sugar on bread right now - the poor man's brekky hehe.",3,eating,butter,4,"Anyways, am eating","['Anyways, am eating a lot', 'Anyways, am eating a sandwich', 'Anyways, am eating my food', 'Anyways, am eating up the sun', 'Anyways, am eating some fruit']",0.6045430898666382,0.20640575981476667
eat,I mean the last place i worked at was so anal about making money it charged its employees if they wanted to eat the food there!,22,eat,food,24,I mean the last place i worked at was so anal about making money it charged its employees if they wanted to eat the,"['I mean the last place i worked at was so anal about making money it charged its employees if they wanted to eat the food', 'I mean the last place i worked at was so anal about making money it charged its employees if they wanted to eat the free food', 'I mean the last place i worked at was so anal about making money it charged its employees if they wanted to eat the same food', 'I mean the last place i worked at was so anal about making money it charged its employees if they wanted to eat the night shift']",1.0000001192092896,1.0
eat,"There once was a girl from doncaster who liked to eat chips, wood and plaster she fell ill one day got taken away leaving her house looking somewhat lacklustre   geddit?",10,eat,chips,11,There once was a girl from doncaster who liked to eat,"['There once was a girl from doncaster who liked to eat a lot', 'There once was a girl from doncaster who liked to eat ice cream', 'There once was a girl from doncaster who liked to eat chocolate', 'There once was a girl from doncaster who liked to eat\n\ndessert allies', 'There once was a girl from doncaster who liked to eat sandwiches']",0.8444128632545471,0.14486877058511585
eat,She was eating her house that's why she was ill and...and... (silence from the audience),2,eating,house,4,She was eating her,"['She was eating her dinner', 'She was eating her first meal', 'She was eating her breakfast', 'She was eating her lunch', 'She was eating her cereal']",0.6815979480743408,0.3254108354419694
eat,The things she said...  'did you know that how you hold your chopsticks means how far away your future partner is?'  'did you know that you can eat the fish's bones?,34,eat,bones,38,The things she said...  'did you know that how you hold your chopsticks means how far away your future partner is?'  'did you know that you can eat the fish's,"[""The things she said...  'did you know that how you hold your chopsticks means how far away your future partner is?'  'did you know that you can eat the fish's flesh"", ""The things she said...  'did you know that how you hold your chopsticks means how far away your future partner is?'  'did you know that you can eat the fish's liver"", ""The things she said...  'did you know that how you hold your chopsticks means how far away your future partner is?'  'did you know that you can eat the fish's mouth"", ""The things she said...  'did you know that how you hold your chopsticks means how far away your future partner is?'  'did you know that you can eat the fish's head"", ""The things she said...  'did you know that how you hold your chopsticks means how far away your future partner is?'  'did you know that you can eat the fish's entire body""]",0.9917418360710144,0.6006435390179642
eat,"Food alert  am reading a book charles  lent to me called  eat chocolate, drink alcohol and be lean and healthy  by andrew jobling.",14,eat,chocolate,15,Food alert  am reading a book charles  lent to me called  eat,"['Food alert  am reading a book charles  lent to me called  eat your heart', 'Food alert  am reading a book charles  lent to me called  eat your vegetables', 'Food alert  am reading a book charles  lent to me called  eat the fat', 'Food alert  am reading a book charles  lent to me called  eat my words', 'Food alert  am reading a book charles  lent to me called  eat this book']",0.9149259328842163,0.23913809635699657
eat,"Watching your glycemic intake, eating smaller but more frequent meals, among other things.",5,eating,meals,10,"Watching your glycemic intake, eating smaller but more frequent","['Watching your glycemic intake, eating smaller but more frequent meals']",1.000000238418579,1.0
eat,Eating the leaves will clear you brain.,0,Eating,leaves,2,Eating the,"[""Eating the other's food"", 'Eating the right types', 'Eating the same foods', 'Eating the fish', 'Eating the right foods']",0.47994720935821533,0.2371255424832242
eat,"i was so hot, but my belly is full and that is a good thing, however eating salad while breathing through your mouth is a hard thing to do and not choke.",18,eating,salad,19,"i was so hot, but my belly is full and that is a good thing, however eating","['i was so hot, but my belly is full and that is a good thing, however eating too much fat', 'i was so hot, but my belly is full and that is a good thing, however eating so much food', 'i was so hot, but my belly is full and that is a good thing, however eating a lot', 'i was so hot, but my belly is full and that is a good thing, however eating the same meal', 'i was so hot, but my belly is full and that is a good thing, however eating my breakfast']",0.8512707352638245,0.25008891856001475
eat,"I don't even remember the last time i saw her but it was probably at our north carolina family reunion, eating chicken stew cooked in a large cast iron kettle over an open flame.",22,eating,stew,24,"I don't even remember the last time i saw her but it was probably at our north carolina family reunion, eating chicken","[""I don't even remember the last time i saw her but it was probably at our north carolina family reunion, eating chicken nuggets"", ""I don't even remember the last time i saw her but it was probably at our north carolina family reunion, eating chicken wings"", ""I don't even remember the last time i saw her but it was probably at our north carolina family reunion, eating chicken"", ""I don't even remember the last time i saw her but it was probably at our north carolina family reunion, eating chicken and bbq ribs"", ""I don't even remember the last time i saw her but it was probably at our north carolina family reunion, eating chicken n cheese""]",0.9761497378349304,0.3922022468279387
eat,"Then, this guy that i adore,went on to tell me that at the last mac expo (or whatever) when steve jobs gave his closing statement, he had a friend over to his house during their lunch hour and they watched it on the internet while eating macaroni and then for dessert they had applesauce.",51,eating,macaroni,52,"Then, this guy that i adore,went on to tell me that at the last mac expo (or whatever) when steve jobs gave his closing statement, he had a friend over to his house during their lunch hour and they watched it on the internet while eating","['Then, this guy that i adore,went on to tell me that at the last mac expo (or whatever) when steve jobs gave his closing statement, he had a friend over to his house during their lunch hour and they watched it on the internet while eating dinner', 'Then, this guy that i adore,went on to tell me that at the last mac expo (or whatever) when steve jobs gave his closing statement, he had a friend over to his house during their lunch hour and they watched it on the internet while eating lunch', 'Then, this guy that i adore,went on to tell me that at the last mac expo (or whatever) when steve jobs gave his closing statement, he had a friend over to his house during their lunch hour and they watched it on the internet while eating their lunch', 'Then, this guy that i adore,went on to tell me that at the last mac expo (or whatever) when steve jobs gave his closing statement, he had a friend over to his house during their lunch hour and they watched it on the internet while eating a meal', 'Then, this guy that i adore,went on to tell me that at the last mac expo (or whatever) when steve jobs gave his closing statement, he had a friend over to his house during their lunch hour and they watched it on the internet while eating breakfast']",0.9558093547821045,0.43197838296320656
eat,"Jaques costeau  les mis (though in french it would be lost on me)  jean-marc gaspard itard and the wild boy of aveyron  matisse, degas, la tour, cezanne, monet, rodin, renior, to name a few  joan of arc  let them eat cake.",56,eat,cake,57,"Jaques costeau  les mis (though in french it would be lost on me)  jean-marc gaspard itard and the wild boy of aveyron  matisse, degas, la tour, cezanne, monet, rodin, renior, to name a few  joan of arc  let them eat","['Jaques costeau \x95 les mis (though in french it would be lost on me) \x95 jean-marc gaspard itard and the wild boy of aveyron \x95 matisse, degas, la tour, cezanne, monet, rodin, renior, to name a few \x95 joan of arc \x95 \x93let them eat cake']",1.0,1.0
