lemma (V),sentence,verb index,verb text,dobj,dobj index,truncated sent,replacement sentences,sentence similarity,token similarity
eat,"To further complicate all this, ive seen too many tom & jerry, speedy gonzales, and even micky mouse cartoons to begin to think that its a done deal that the mouse will eat the poison, no matter how enticing.",36,eat,poison,38,"To further complicate all this, ive seen too many tom & jerry, speedy gonzales, and even micky mouse cartoons to begin to think that its a done deal that the mouse will eat the","['To further complicate all this, ive seen too many tom & jerry, speedy gonzales, and even micky mouse cartoons to begin to think that its a done deal that the mouse will eat the pig', 'To further complicate all this, ive seen too many tom & jerry, speedy gonzales, and even micky mouse cartoons to begin to think that its a done deal that the mouse will eat the mouse', 'To further complicate all this, ive seen too many tom & jerry, speedy gonzales, and even micky mouse cartoons to begin to think that its a done deal that the mouse will eat the cat', 'To further complicate all this, ive seen too many tom & jerry, speedy gonzales, and even micky mouse cartoons to begin to think that its a done deal that the mouse will eat the red head']",0.7290566563606262,0.26811350492497565
eat,This entails trying to hide chocolate from him (last week grandfather ate an entire bag of hersey's minibars) and taking the phone away (a couple days ago he called 911 and the cops came to the house - maybe he called because he ran out of chocolate?).,12,ate,bag,15,This entails trying to hide chocolate from him (last week grandfather ate an entire,"['This entails trying to hide chocolate from him (last week grandfather ate an entire pound', 'This entails trying to hide chocolate from him (last week grandfather ate an entire box', 'This entails trying to hide chocolate from him (last week grandfather ate an entire bag', 'This entails trying to hide chocolate from him (last week grandfather ate an entire pint', 'This entails trying to hide chocolate from him (last week grandfather ate an entire chocolate box']",0.9766533970832825,0.3032329880985936
eat,It's like they've never had cake before...or eaten befoe or something.,11,eaten,befoe,12,It's like they've never had cake before...or eaten,"[""It's like they've never had cake before...or eaten food"", ""It's like they've never had cake before...or eaten cake and ice cream"", ""It's like they've never had cake before...or eaten a peanut"", ""It's like they've never had cake before...or eaten cake"", ""It's like they've never had cake before...or eaten a real pizza""]",0.9442379474639893,0.0
eat,"Not only am i never eating asian food again, but my days of delicious diet coke are behind me.",5,eating,food,7,Not only am i never eating asian,"['Not only am i never eating asian food', 'Not only am i never eating asian foods']",1.0000001192092896,1.0
eat,"When i'm here in ny by myself, i don't have many options for things to do: i either go back to my hotel room and watch way too much tv and eat a bag of pirate's booty (my favorite), or i go wander around until the stores close and spend money.",35,eat,bag,37,"When i'm here in ny by myself, i don't have many options for things to do: i either go back to my hotel room and watch way too much tv and eat a","[""When i'm here in ny by myself, i don't have many options for things to do: i either go back to my hotel room and watch way too much tv and eat a lot"", ""When i'm here in ny by myself, i don't have many options for things to do: i either go back to my hotel room and watch way too much tv and eat a whole bunch"", ""When i'm here in ny by myself, i don't have many options for things to do: i either go back to my hotel room and watch way too much tv and eat a few meals"", ""When i'm here in ny by myself, i don't have many options for things to do: i either go back to my hotel room and watch way too much tv and eat a shit ton"", ""When i'm here in ny by myself, i don't have many options for things to do: i either go back to my hotel room and watch way too much tv and eat a bunch""]",0.9694458246231079,0.1525027689798859
eat,"I can't wait to eat  real  fish and chips, watch the big breakfast, go to some good indian restaurants, attend an evensong at westminster abbey, eat belgian chocolate, and talk to many british men.",5,eat,fish,9,I can't wait to eat  real  ,"['I can\'t wait to eat  real  ""\n\nYurika', ""I can't wait to eat  real  \xa0furry""]",0.5587061047554016,-0.012558204054047173
eat,"I can't wait to eat  real  fish and chips, watch the big breakfast, go to some good indian restaurants, attend an evensong at westminster abbey, eat belgian chocolate, and talk to many british men.",32,eat,chocolate,34,"I can't wait to eat  real  fish and chips, watch the big breakfast, go to some good indian restaurants, attend an evensong at westminster abbey, eat belgian","[""I can't wait to eat  real  fish and chips, watch the big breakfast, go to some good indian restaurants, attend an evensong at westminster abbey, eat belgian and french fries"", ""I can't wait to eat  real  fish and chips, watch the big breakfast, go to some good indian restaurants, attend an evensong at westminster abbey, eat belgian food"", ""I can't wait to eat  real  fish and chips, watch the big breakfast, go to some good indian restaurants, attend an evensong at westminster abbey, eat belgian waffles"", ""I can't wait to eat  real  fish and chips, watch the big breakfast, go to some good indian restaurants, attend an evensong at westminster abbey, eat belgian beers"", ""I can't wait to eat  real  fish and chips, watch the big breakfast, go to some good indian restaurants, attend an evensong at westminster abbey, eat belgian pancakes""]",0.9935788512229919,0.5341352833689744
eat,I just spent my lunch time in the company-provided break room trying to peacefully eat my lunch and read my book.,16,eat,lunch,18,I just spent my lunch time in the company-provided break room trying to peacefully eat my,"['I just spent my lunch time in the company-provided break room trying to peacefully eat my salad', 'I just spent my lunch time in the company-provided break room trying to peacefully eat my meal', 'I just spent my lunch time in the company-provided break room trying to peacefully eat my lunch', 'I just spent my lunch time in the company-provided break room trying to peacefully eat my food', 'I just spent my lunch time in the company-provided break room trying to peacefully eat my sandwich']",0.8946242332458496,0.48800264938428056
eat,"I highly recommend the series of unfortunate events series  6.  eat orange tic tacs like candy, instead of using them as breath mints  7.",13,eat,tacs,16,I highly recommend the series of unfortunate events series  6.  eat orange tic,"['I highly recommend the series of unfortunate events series  6.  eat orange ticot', 'I highly recommend the series of unfortunate events series  6.  eat orange tic tac toe', 'I highly recommend the series of unfortunate events series  6.  eat orange tic chips', 'I highly recommend the series of unfortunate events series  6.  eat orange tiches', 'I highly recommend the series of unfortunate events series  6.  eat orange tic-tac-toe']",0.9127048254013062,0.0
eat,You know you're pathetically single when you eat bologna sandwiches for dinner.,8,eat,sandwiches,10,You know you're pathetically single when you eat bologna,"[""You know you're pathetically single when you eat bologna sandwiches"", ""You know you're pathetically single when you eat bologna bread""]",1.0,1.0
eat,Have you been eating the taffy again?,3,eating,taffy,5,Have you been eating the,"['Have you been eating the same thing', 'Have you been eating the ""toughest"" foods', 'Have you been eating the same things', 'Have you been eating the new recipe', 'Have you been eating the same food']",0.6065714359283447,0.04468162929559701
eat,Some highlights: -- eating king crab legs and a bottle of wine...then going to a hole-in-the-wall bar with great u2 albums on the jukebox.,4,eating,legs,7,Some highlights: -- eating king crab,['Some highlights: -- eating king crab'],0.9876583814620972,0.24479469987778202
eat,"I have always been a big fan of the traditional special k  growing up, my grandma ate a bowl everyday while preaching your mantra to anyone who would listen: if you can pinch an inch  so with the addition of the red berries, not only am i keeping grandmas legacy alive, but im also enjoying the sweetness the new berries have to offer.",18,ate,bowl,20,"I have always been a big fan of the traditional special k  growing up, my grandma ate a","['I have always been a big fan of the traditional special k  growing up, my grandma ate a lot', 'I have always been a big fan of the traditional special k  growing up, my grandma ate a ton']",0.8855017423629761,0.08376003516331097
eat,"Djs, thank you for eating the rest of the sausages...and taking them down.",5,eating,rest,7,"Djs, thank you for eating the","['Djs, thank you for eating the cake', 'Djs, thank you for eating the apple', 'Djs, thank you for eating the shit', 'Djs, thank you for eating the cookies', 'Djs, thank you for eating the pizza']",0.762764573097229,0.05664270952052064
eat,"A friend is eating cake at her workplace, because it's her birthday on sunday and they're celebrating today.",3,eating,cake,4,A friend is eating,"['A friend is eating dinner', 'A friend is eating her sandwich', 'A friend is eating ice cream', 'A friend is eating her dinner', 'A friend is eating her lunch']",0.5280908346176147,0.44783747585226347
eat,I was hungover today too - plus generally feeling gross after eating brownies and cookies and hummus and pita and chips and cheese and lime chips and baked cheesy chips and bread and artichoke dip.,11,eating,brownies,12,I was hungover today too - plus generally feeling gross after eating,"['I was hungover today too - plus generally feeling gross after eating all the food', 'I was hungover today too - plus generally feeling gross after eating a half decent meal', 'I was hungover today too - plus generally feeling gross after eating pizza', 'I was hungover today too - plus generally feeling gross after eating a lot', 'I was hungover today too - plus generally feeling gross after eating a whole bag']",0.9183942675590515,0.37138950706221235
eat,"A lot of people like to eat frosting, except me.",6,eat,frosting,7,A lot of people like to eat,"['A lot of people like to eat this stuff', 'A lot of people like to eat a lot', 'A lot of people like to eat their vegetables', 'A lot of people like to eat chicken', 'A lot of people like to eat salads']",0.6460763812065125,0.2912301991196639
eat,"Weren't you cheered to see the ironworkers sitting on an i-beam dangling from a cable, in a row, like starlings, eating lunch, maybe baloney on white with flourescent mustard?",26,eating,lunch,27,"Weren't you cheered to see the ironworkers sitting on an i-beam dangling from a cable, in a row, like starlings, eating","[""Weren't you cheered to see the ironworkers sitting on an i-beam dangling from a cable, in a row, like starlings, eating their food"", ""Weren't you cheered to see the ironworkers sitting on an i-beam dangling from a cable, in a row, like starlings, eating their way"", ""Weren't you cheered to see the ironworkers sitting on an i-beam dangling from a cable, in a row, like starlings, eating a meal"", ""Weren't you cheered to see the ironworkers sitting on an i-beam dangling from a cable, in a row, like starlings, eating their dinner"", ""Weren't you cheered to see the ironworkers sitting on an i-beam dangling from a cable, in a row, like starlings, eating the green leaves""]",0.9768768548965454,0.39089711315002645
eat,"This is a lot of pressure - i mean, i already have to stop eating meat on fridays, and then there's the whole easter vigil thing on holy saturday which is just about the longest mass in existence.",15,eating,meat,16,"This is a lot of pressure - i mean, i already have to stop eating","['This is a lot of pressure - i mean, i already have to stop eating the same food', 'This is a lot of pressure - i mean, i already have to stop eating food', 'This is a lot of pressure - i mean, i already have to stop eating meat', 'This is a lot of pressure - i mean, i already have to stop eating a lot']",0.7784775495529175,0.6200302489571704
eat,"So i'll pray for world peace, and i'll even abstain from eating meat, but no eating between meals is going to be tough...especially considering my mom just gave me 5 boxes of girl scout cookies and they're sitting on my desk right now.",14,eating,meat,15,"So i'll pray for world peace, and i'll even abstain from eating","[""So i'll pray for world peace, and i'll even abstain from eating meat"", ""So i'll pray for world peace, and i'll even abstain from eating the meat"", ""So i'll pray for world peace, and i'll even abstain from eating pork"", ""So i'll pray for world peace, and i'll even abstain from eating beef""]",1.0000001192092896,1.0
eat,"Its cheap, you get to eat tons and tons of good food, and you get to sit in the sunshine.",6,eat,tons,7,"Its cheap, you get to eat","['Its cheap, you get to eat a lot', 'Its cheap, you get to eat the food']",0.9543219804763794,0.2784328335556981
eat,"I ate escargot for the first time in my life, and was introduced to guavaberry rum  which is really tasty in guavaberry coladas.",1,ate,escargot,2,I ate,"['I ate a lot', 'I ate a big bowl', 'I ate the whole thing', 'I ate a raw chicken breast', 'I ate all my meat']",0.5596507787704468,0.08295294344225444
eat,"Rosemary consumer affairs department   on the bottom of rosemary's very unremarkable retort, there was a push to remember to eat breakfast...   national school breakfast week is the perfect time to remind parents of the importance of eating a good breakfast.",22,eat,breakfast,23,"Rosemary consumer affairs department   on the bottom of rosemary's very unremarkable retort, there was a push to remember to eat","[""Rosemary consumer affairs department   on the bottom of rosemary's very unremarkable retort, there was a push to remember to eat more rosemary"", ""Rosemary consumer affairs department   on the bottom of rosemary's very unremarkable retort, there was a push to remember to eat rosemary"", ""Rosemary consumer affairs department   on the bottom of rosemary's very unremarkable retort, there was a push to remember to eat the same amount"", ""Rosemary consumer affairs department   on the bottom of rosemary's very unremarkable retort, there was a push to remember to eat some rosemary""]",0.8867484331130981,0.29212557104458203
eat,"Rosemary consumer affairs department   on the bottom of rosemary's very unremarkable retort, there was a push to remember to eat breakfast...   national school breakfast week is the perfect time to remind parents of the importance of eating a good breakfast.",41,eating,breakfast,44,"Rosemary consumer affairs department   on the bottom of rosemary's very unremarkable retort, there was a push to remember to eat breakfast...   national school breakfast week is the perfect time to remind parents of the importance of eating a good","[""Rosemary consumer affairs department   on the bottom of rosemary's very unremarkable retort, there was a push to remember to eat breakfast...   national school breakfast week is the perfect time to remind parents of the importance of eating a good breakfast"", ""Rosemary consumer affairs department   on the bottom of rosemary's very unremarkable retort, there was a push to remember to eat breakfast...   national school breakfast week is the perfect time to remind parents of the importance of eating a good, nutritious breakfast""]",1.0000001192092896,1.0
eat,Findings from studies conducted by nutrition research organizations continue to support the fact that children who eat breakfast do better academically and behave better in school than those who do not.,16,eat,breakfast,17,Findings from studies conducted by nutrition research organizations continue to support the fact that children who eat,"['Findings from studies conducted by nutrition research organizations continue to support the fact that children who eat a healthy diet', 'Findings from studies conducted by nutrition research organizations continue to support the fact that children who eat a low-fat diet', 'Findings from studies conducted by nutrition research organizations continue to support the fact that children who eat a diet', 'Findings from studies conducted by nutrition research organizations continue to support the fact that children who eat more fruits', 'Findings from studies conducted by nutrition research organizations continue to support the fact that children who eat a varied diet']",0.8063172101974487,0.4139450943295673
eat,The key reason...not eating breakfast means that blood sugar levels remain too low to allow for proper concentration.,5,eating,breakfast,6,The key reason...not eating,"['The key reason...not eating your sugar', 'The key reason...not eating gluten', 'The key reason...not eating a whole lot', 'The key reason...not eating the chicken', 'The key reason...not eating a full meal']",0.6174507737159729,0.36948839371691
eat,My brother always ate breakfast when we were growing up and that never made him 'behave better.',3,ate,breakfast,4,My brother always ate,"['My brother always ate breakfast', 'My brother always ate the same way', 'My brother always ate his food', 'My brother always ate the same chicken', 'My brother always ate a lot']",1.0,1.0
eat,Duf makes a bid for eternal hell fire:   ...then she should have sang about eating a ham sandwich or somethin'!,17,eating,sandwich,20,Duf makes a bid for eternal hell fire:   ...then she should have sang about eating a ham,"['Duf makes a bid for eternal hell fire:   ...then she should have sang about eating a ham sandwich', 'Duf makes a bid for eternal hell fire:   ...then she should have sang about eating a ham', 'Duf makes a bid for eternal hell fire:   ...then she should have sang about eating a hamster']",1.0,1.0
eat,I'm eating papaya right now.,2,eating,papaya,3,I'm eating,"[""I'm eating a lot"", ""I'm eating more chicken"", ""I'm eating a cup"", ""I'm eating my cake"", ""I'm eating a steak""]",0.4880961775779724,0.11116132764463012
eat,They can eat a dick all the way up.,2,eat,dick,4,They can eat a,"['They can eat a whole chicken', 'They can eat a lot', 'They can eat a whole cow', 'They can eat a bowl', 'They can eat a small amount']",0.660872757434845,0.18367497825019993
eat,"Finally, the evening was concluded by  eating pizza at dulonos .",8,eating,pizza,9,"Finally, the evening was concluded by  eating","['Finally, the evening was concluded by  eating fresh strawberry jam', 'Finally, the evening was concluded by  eating a small pizza', 'Finally, the evening was concluded by  eating a delicious dinner', 'Finally, the evening was concluded by  eating a meal', 'Finally, the evening was concluded by  eating delicious sweets']",0.6108111143112183,0.3437467348266064
eat,"We'll be eating mouthwatering hotdogs, delicious chips, and savory soft drinks.",3,eating,hotdogs,5,We'll be eating mouthwatering,"[""We'll be eating mouthwatering food"", ""We'll be eating mouthwatering foods"", ""We'll be eating mouthwatering"", ""We'll be eating mouthwatering meals"", ""We'll be eating mouthwatering dishes""]",0.8647555112838745,0.4092502123800288
eat,"The next night, after the yo la tengo show (killer, btw), we were innocently eating a nice meal at clarke's diner, when our waitress came over with 2 glasses of milk.",19,eating,meal,22,"The next night, after the yo la tengo show (killer, btw), we were innocently eating a nice","['The next night, after the yo la tengo show (killer, btw), we were innocently eating a nice, hot meal', 'The next night, after the yo la tengo show (killer, btw), we were innocently eating a nice lunch', 'The next night, after the yo la tengo show (killer, btw), we were innocently eating a nice salad', 'The next night, after the yo la tengo show (killer, btw), we were innocently eating a nice meal', 'The next night, after the yo la tengo show (killer, btw), we were innocently eating a nice dinner']",0.9548787474632263,1.0
eat,(too busy eating my churro and drinking hot chocolate.,3,eating,churro,5,(too busy eating my,"['(too busy eating my food', '(too busy eating my own dinner', '(too busy eating my breakfast', '(too busy eating my own hair', '(too busy eating my own feces']",0.7786369323730469,0.34837118777431086
eat,"If you still listen to this new liz phair cd even a year from now, i will eat her nasty underwear and say it's my 'favorite.'",18,eat,underwear,21,"If you still listen to this new liz phair cd even a year from now, i will eat her nasty","['If you still listen to this new liz phair cd even a year from now, i will eat her nasty ass', 'If you still listen to this new liz phair cd even a year from now, i will eat her nasty fat ass', 'If you still listen to this new liz phair cd even a year from now, i will eat her nasty face', 'If you still listen to this new liz phair cd even a year from now, i will eat her nasty little cunt', 'If you still listen to this new liz phair cd even a year from now, i will eat her nasty little heart']",0.8884710073471069,0.26583419469305053
eat,"Before i hit the theatre, dirty and i ate a burrito.",9,ate,burrito,11,"Before i hit the theatre, dirty and i ate a","['Before i hit the theatre, dirty and i ate a couple', 'Before i hit the theatre, dirty and i ate a shitload', 'Before i hit the theatre, dirty and i ate a banana', 'Before i hit the theatre, dirty and i ate a chocolate bar', 'Before i hit the theatre, dirty and i ate a lot']",0.8316811919212341,0.08970145959144254
eat,"Third, when i go to a restaurant, i usually eat the same thing.",11,eat,thing,14,"Third, when i go to a restaurant, i usually eat the same","['Third, when i go to a restaurant, i usually eat the same dish', 'Third, when i go to a restaurant, i usually eat the same things', 'Third, when i go to a restaurant, i usually eat the same food', 'Third, when i go to a restaurant, i usually eat the same thing', 'Third, when i go to a restaurant, i usually eat the same stuff']",0.9761008024215698,0.3755313270372028
eat,"I know enough not to embarass myself at a business dinner, but i could also use some culinary refinements (ex:  we were at savories in stillwater last weekend, and when they brought out the figs with candied almonds and creamed gorgonzola as a pre-meal palate exciter, not only did i think it was tiny limes with whipped cream, but i didn't know if i should eat the entire fig or what...help!)",75,eat,fig,78,"I know enough not to embarass myself at a business dinner, but i could also use some culinary refinements (ex:  we were at savories in stillwater last weekend, and when they brought out the figs with candied almonds and creamed gorgonzola as a pre-meal palate exciter, not only did i think it was tiny limes with whipped cream, but i didn't know if i should eat the entire","[""I know enough not to embarass myself at a business dinner, but i could also use some culinary refinements (ex:  we were at savories in stillwater last weekend, and when they brought out the figs with candied almonds and creamed gorgonzola as a pre-meal palate exciter, not only did i think it was tiny limes with whipped cream, but i didn't know if i should eat the entire set"", ""I know enough not to embarass myself at a business dinner, but i could also use some culinary refinements (ex:  we were at savories in stillwater last weekend, and when they brought out the figs with candied almonds and creamed gorgonzola as a pre-meal palate exciter, not only did i think it was tiny limes with whipped cream, but i didn't know if i should eat the entire thing"", ""I know enough not to embarass myself at a business dinner, but i could also use some culinary refinements (ex:  we were at savories in stillwater last weekend, and when they brought out the figs with candied almonds and creamed gorgonzola as a pre-meal palate exciter, not only did i think it was tiny limes with whipped cream, but i didn't know if i should eat the entire package"", ""I know enough not to embarass myself at a business dinner, but i could also use some culinary refinements (ex:  we were at savories in stillwater last weekend, and when they brought out the figs with candied almonds and creamed gorgonzola as a pre-meal palate exciter, not only did i think it was tiny limes with whipped cream, but i didn't know if i should eat the entire bottle"", ""I know enough not to embarass myself at a business dinner, but i could also use some culinary refinements (ex:  we were at savories in stillwater last weekend, and when they brought out the figs with candied almonds and creamed gorgonzola as a pre-meal palate exciter, not only did i think it was tiny limes with whipped cream, but i didn't know if i should eat the entire stack""]",0.995302140712738,0.04131052918745297
eat,I couldn't eat cereal for a couple days because i couldn't find my bowls.,3,eat,cereal,4,I couldn't eat,"[""I couldn't eat shit"", ""I couldn't eat dinner"", ""I couldn't eat a single piece""]",0.6949611902236938,0.19413157404998999
eat,I went to a brand new all-you-can-eat sushi/teriyaki restaurant last night.,12,eat,restaurant,16,I went to a brand new all-you-can-eat sushi/teriyaki,"['I went to a brand new all-you-can-eat sushi/teriyaki bar', 'I went to a brand new all-you-can-eat sushi/teriyaki joint', 'I went to a brand new all-you-can-eat sushi/teriyaki restaurant', 'I went to a brand new all-you-can-eat sushi/teriyaki place', 'I went to a brand new all-you-can-eat sushi/teriyaki buffet']",0.974394679069519,0.5526777884582164
