lemma (V),sentence,verb index,verb text,dobj,dobj index,truncated sent,replacement sentences,sentence similarity,token similarity
eat,"so apparently, at walgreens, they are encouraging the practice many people attempt to leave in kindergarten, eating paste.",19,eating,paste,20,"so apparently, at walgreens, they are encouraging the practice many people attempt to leave in kindergarten, eating","['so apparently, at walgreens, they are encouraging the practice many people attempt to leave in kindergarten, eating the most expensive food', 'so apparently, at walgreens, they are encouraging the practice many people attempt to leave in kindergarten, eating the bagel', 'so apparently, at walgreens, they are encouraging the practice many people attempt to leave in kindergarten, eating cereal', 'so apparently, at walgreens, they are encouraging the practice many people attempt to leave in kindergarten, eating a big bag', 'so apparently, at walgreens, they are encouraging the practice many people attempt to leave in kindergarten, eating their food']",0.7445455193519592,0.3158072270134729
eat,How ironic is it that someone who is probably going to be the next tuna spokeswoman (insert perverted joke here) can now afford to eat filet every night?,26,eat,filet,27,How ironic is it that someone who is probably going to be the next tuna spokeswoman (insert perverted joke here) can now afford to eat,"['How ironic is it that someone who is probably going to be the next tuna spokeswoman (insert perverted joke here) can now afford to eat her own fish', 'How ironic is it that someone who is probably going to be the next tuna spokeswoman (insert perverted joke here) can now afford to eat the things', 'How ironic is it that someone who is probably going to be the next tuna spokeswoman (insert perverted joke here) can now afford to eat a fish', 'How ironic is it that someone who is probably going to be the next tuna spokeswoman (insert perverted joke here) can now afford to eat tuna', 'How ironic is it that someone who is probably going to be the next tuna spokeswoman (insert perverted joke here) can now afford to eat a tuna salad']",0.8938390016555786,0.33403678507912576
eat,"I'd sip root beer and eat matt's chocolate chip cookies from grandma's famous glass cookie jar, and sing with harry caray during the 7th inning stretch.",6,eat,cookies,11,I'd sip root beer and eat matt's chocolate chip,"[""I'd sip root beer and eat matt's chocolate chip cookies""]",1.0,1.0
eat,"i am not a big fan of reality series either since the main premise is to imitate real life, but hey, who really lives with 20 other women competing for one man, or on a deserted island eating bugs, or who marries their sister's third husband who has survived a killer bee attack and given birth?",40,eating,bugs,41,"i am not a big fan of reality series either since the main premise is to imitate real life, but hey, who really lives with 20 other women competing for one man, or on a deserted island eating","['i am not a big fan of reality series either since the main premise is to imitate real life, but hey, who really lives with 20 other women competing for one man, or on a deserted island eating raw meat', 'i am not a big fan of reality series either since the main premise is to imitate real life, but hey, who really lives with 20 other women competing for one man, or on a deserted island eating pizza', 'i am not a big fan of reality series either since the main premise is to imitate real life, but hey, who really lives with 20 other women competing for one man, or on a deserted island eating garbage', 'i am not a big fan of reality series either since the main premise is to imitate real life, but hey, who really lives with 20 other women competing for one man, or on a deserted island eating food', 'i am not a big fan of reality series either since the main premise is to imitate real life, but hey, who really lives with 20 other women competing for one man, or on a deserted island eating lobster']",0.9877725839614868,0.16122615083297703
eat,"It seems like night all day, and i'm eating way too much food from the craft services tables.",10,eating,food,14,"It seems like night all day, and i'm eating way too much","[""It seems like night all day, and i'm eating way too much food"", ""It seems like night all day, and i'm eating way too much junk food""]",1.0,1.0
eat,"If you take a can of nuts and dump them in your backyard, you'd better believe i'm gonna eat those nuts.",22,eat,nuts,24,"If you take a can of nuts and dump them in your backyard, you'd better believe i'm gonna eat those","[""If you take a can of nuts and dump them in your backyard, you'd better believe i'm gonna eat those nuts"", ""If you take a can of nuts and dump them in your backyard, you'd better believe i'm gonna eat those peanuts""]",1.0,1.0
eat,"Just so you don't get the wrong idea, eating nuts isn't all i do.",10,eating,nuts,11,"Just so you don't get the wrong idea, eating","[""Just so you don't get the wrong idea, eating a turkey"", ""Just so you don't get the wrong idea, eating a large bowl"", ""Just so you don't get the wrong idea, eating a high-fat diet"", ""Just so you don't get the wrong idea, eating a high-carb diet"", ""Just so you don't get the wrong idea, eating too many calories""]",0.5016524195671082,0.4056333569010459
eat,"You won't offend me if you assume that i eat nuts, because it's true.",10,eat,nuts,11,You won't offend me if you assume that i eat,"[""You won't offend me if you assume that i eat meat"", ""You won't offend me if you assume that i eat no meat"", ""You won't offend me if you assume that i eat a lot"", ""You won't offend me if you assume that i eat all the things"", ""You won't offend me if you assume that i eat only vegetables""]",0.7022991180419922,0.42243240464651194
eat,"If, when i'm gone, you hear someone say, 'that danny, he was a good guy, but he didn't eat many nuts,' i insist you set them straight.",26,eat,nuts,28,"If, when i'm gone, you hear someone say, 'that danny, he was a good guy, but he didn't eat many","[""If, when i'm gone, you hear someone say, 'that danny, he was a good guy, but he didn't eat many dumplings"", ""If, when i'm gone, you hear someone say, 'that danny, he was a good guy, but he didn't eat many vegetables"", ""If, when i'm gone, you hear someone say, 'that danny, he was a good guy, but he didn't eat many cookies"", ""If, when i'm gone, you hear someone say, 'that danny, he was a good guy, but he didn't eat many things"", ""If, when i'm gone, you hear someone say, 'that danny, he was a good guy, but he didn't eat many potatoes""]",0.8042271137237549,0.329874417830821
eat,John and i just put on one of his stories while we're eating dinner and just laugh.,13,eating,dinner,14,John and i just put on one of his stories while we're eating,"[""John and i just put on one of his stories while we're eating lunch"", ""John and i just put on one of his stories while we're eating dinner""]",0.9648452997207642,0.8361954071598431
eat,Ate grass.',0,Ate,grass,1,Ate,"['Ate the chicken', 'Ate My Heart', 'Ate the food']",0.5324075818061829,0.39299461262301105
eat,emailalert=no&email=adgrant@indiana.edu&url=http://closeproximity.blogspot.com&name=proximity&bgcolor=003399&fcolor=ffffff&link=ffffcc&words=comments&title=comments &width=350&height=350'>    my boss was telling me that at sundance a  urllink documentary  debuted about a perfectly healthy guy who decided to eat mcdonalds 3 meals a day for 30 days.,44,eat,meals,47,emailalert=no&email=adgrant@indiana.edu&url=http://closeproximity.blogspot.com&name=proximity&bgcolor=003399&fcolor=ffffff&link=ffffcc&words=comments&title=comments &width=350&height=350'>    my boss was telling me that at sundance a  urllink documentary  debuted about a perfectly healthy guy who decided to eat mcdonalds 3,"[""emailalert=no&email=adgrant@indiana.edu&url=http://closeproximity.blogspot.com&name=proximity&bgcolor=003399&fcolor=ffffff&link=ffffcc&words=comments&title=comments &width=350&height=350'>    my boss was telling me that at sundance a  urllink documentary  debuted about a perfectly healthy guy who decided to eat mcdonalds"", ""emailalert=no&email=adgrant@indiana.edu&url=http://closeproximity.blogspot.com&name=proximity&bgcolor=003399&fcolor=ffffff&link=ffffcc&words=comments&title=comments &width=350&height=350'>    my boss was telling me that at sundance a  urllink documentary  debuted about a perfectly healthy guy who decided to eat mcdonalds 3 meals""]",0.9915881752967834,0.18732485907219543
eat,This table of women eating their taquitos let out the hugest yelps and belted the little pidgie in mid-air.,4,eating,taquitos,6,This table of women eating their,"['This table of women eating their fill', 'This table of women eating their favourite food', 'This table of women eating their eggs', 'This table of women eating their way', 'This table of women eating their favorite foods']",0.7620846629142761,0.01951127718458965
eat,"I'm still leery of the whole atkins fad, and i think exercise, avoiding caffeine, drinking lots of water, and eating balanced meals is the way to go.",24,eating,meals,26,"I'm still leery of the whole atkins fad, and i think exercise, avoiding caffeine, drinking lots of water, and eating balanced","[""I'm still leery of the whole atkins fad, and i think exercise, avoiding caffeine, drinking lots of water, and eating balanced meals"", ""I'm still leery of the whole atkins fad, and i think exercise, avoiding caffeine, drinking lots of water, and eating balanced foods"", ""I'm still leery of the whole atkins fad, and i think exercise, avoiding caffeine, drinking lots of water, and eating balanced protein/carbohydrates""]",1.0,1.0
eat,"From the guy at the art institute who was hellbent on getting us to eat dinner at bennigan's to the friendly-yet nonsensical guy on the el to mark, the lawyer who just had a baby, who chatted with us at the bar, everyone was really talkative and fun.",14,eat,dinner,15,From the guy at the art institute who was hellbent on getting us to eat,"['From the guy at the art institute who was hellbent on getting us to eat pizza', 'From the guy at the art institute who was hellbent on getting us to eat the same thing', 'From the guy at the art institute who was hellbent on getting us to eat a salad', 'From the guy at the art institute who was hellbent on getting us to eat a certain food', 'From the guy at the art institute who was hellbent on getting us to eat our own poop']",0.8384100198745728,0.5379820731251566
eat,These can be things you've been eating a lot of this week either at home or at a restaurant.,7,eating,lot,9,These can be things you've been eating a,"[""These can be things you've been eating a lot""]",1.0,1.0
eat,"Jon and i eat the same basic meals every week: tacos (my personal favorite), ravioli, salad and bread, frozen pizza, pasta...or we go out.",3,eat,meals,7,Jon and i eat the same basic,"['Jon and i eat the same basic food', 'Jon and i eat the same basic foods', 'Jon and i eat the same basic meal', 'Jon and i eat the same basic diet', 'Jon and i eat the same basic combo']",0.9749846458435059,0.6861099294526144
eat,"We kicked it on fisherman's wharf and watched the sea lions that have a fine colony there, saw alcatraz (but didn't take the tour), and ate a great sundae at the ghiradelli restaurant (nothing wrong with a 'restaurant' that only has chocolate treats on the menu).",31,ate,sundae,34,"We kicked it on fisherman's wharf and watched the sea lions that have a fine colony there, saw alcatraz (but didn't take the tour), and ate a great","[""We kicked it on fisherman's wharf and watched the sea lions that have a fine colony there, saw alcatraz (but didn't take the tour), and ate a great dinner"", ""We kicked it on fisherman's wharf and watched the sea lions that have a fine colony there, saw alcatraz (but didn't take the tour), and ate a great meal"", ""We kicked it on fisherman's wharf and watched the sea lions that have a fine colony there, saw alcatraz (but didn't take the tour), and ate a great steak"", ""We kicked it on fisherman's wharf and watched the sea lions that have a fine colony there, saw alcatraz (but didn't take the tour), and ate a great deal"", ""We kicked it on fisherman's wharf and watched the sea lions that have a fine colony there, saw alcatraz (but didn't take the tour), and ate a great lunch""]",0.9819501638412476,0.3967858033414258
eat,"I love valentine's day because, significant other or not, it's a holiday that encourages eating lots of candy, so it's up there with halloween and easter for me.",18,eating,lots,19,"I love valentine's day because, significant other or not, it's a holiday that encourages eating",[],-1.0,-1.0
eat,We get a cartoon scene with a witch who has a man eating vagina!,12,eating,vagina,13,We get a cartoon scene with a witch who has a man eating,"['We get a cartoon scene with a witch who has a man eating a baby', 'We get a cartoon scene with a witch who has a man eating a fish', 'We get a cartoon scene with a witch who has a man eating her head', 'We get a cartoon scene with a witch who has a man eating his own butt', 'We get a cartoon scene with a witch who has a man eating a carrot']",0.8829395771026611,0.4200330521331878
eat,emailalert=no&email=adgrant@indiana.edu&url=http://closeproximity.blogspot.com&name=proximity&bgcolor=003399&fcolor=ffffff&link=ffffcc&words=comments&title=comments &width=350&height=350'>    here is a pinata for you to beat with a baseball bat and then eat lots of snacks that come out of it's stomach.,36,eat,lots,37,emailalert=no&email=adgrant@indiana.edu&url=http://closeproximity.blogspot.com&name=proximity&bgcolor=003399&fcolor=ffffff&link=ffffcc&words=comments&title=comments &width=350&height=350'>    here is a pinata for you to beat with a baseball bat and then eat,"[""emailalert=no&email=adgrant@indiana.edu&url=http://closeproximity.blogspot.com&name=proximity&bgcolor=003399&fcolor=ffffff&link=ffffcc&words=comments&title=comments &width=350&height=350'>    here is a pinata for you to beat with a baseball bat and then eat a little piece"", ""emailalert=no&email=adgrant@indiana.edu&url=http://closeproximity.blogspot.com&name=proximity&bgcolor=003399&fcolor=ffffff&link=ffffcc&words=comments&title=comments &width=350&height=350'>    here is a pinata for you to beat with a baseball bat and then eat a bunch"", ""emailalert=no&email=adgrant@indiana.edu&url=http://closeproximity.blogspot.com&name=proximity&bgcolor=003399&fcolor=ffffff&link=ffffcc&words=comments&title=comments &width=350&height=350'>    here is a pinata for you to beat with a baseball bat and then eat the whole thing"", ""emailalert=no&email=adgrant@indiana.edu&url=http://closeproximity.blogspot.com&name=proximity&bgcolor=003399&fcolor=ffffff&link=ffffcc&words=comments&title=comments &width=350&height=350'>    here is a pinata for you to beat with a baseball bat and then eat a piece""]",0.9839191436767578,0.19007744853870012
eat,"Now is my church, just this past sunday, our priest gave us a lecture about leaving early and coming late and then dropped the bomb: apparently some people in our church have not been eating their host at communion and have been leaving it in the pews and song books instead.",37,eating,host,39,"Now is my church, just this past sunday, our priest gave us a lecture about leaving early and coming late and then dropped the bomb: apparently some people in our church have not been eating their","['Now is my church, just this past sunday, our priest gave us a lecture about leaving early and coming late and then dropped the bomb: apparently some people in our church have not been eating their vegetables', 'Now is my church, just this past sunday, our priest gave us a lecture about leaving early and coming late and then dropped the bomb: apparently some people in our church have not been eating their carbs', 'Now is my church, just this past sunday, our priest gave us a lecture about leaving early and coming late and then dropped the bomb: apparently some people in our church have not been eating their fish', 'Now is my church, just this past sunday, our priest gave us a lecture about leaving early and coming late and then dropped the bomb: apparently some people in our church have not been eating their breakfast', 'Now is my church, just this past sunday, our priest gave us a lecture about leaving early and coming late and then dropped the bomb: apparently some people in our church have not been eating their Lenten bread']",0.8449781537055969,0.10553423267003094
eat,"emailalert=no&email=adgrant@indiana.edu&url=http://closeproximity.blogspot.com&name=proximity&bgcolor=003399&fcolor=ffffff&link=ffffcc&words=comments&title=comments &width=350&height=350'>   urllink ch.bmp  after bawling my eyes out from mike's departure this morning (that's right, he ditched alison to stay in chicago and hang with matt and me), i decided to eat a waffle and check the weather on tv.",59,eat,waffle,61,"emailalert=no&email=adgrant@indiana.edu&url=http://closeproximity.blogspot.com&name=proximity&bgcolor=003399&fcolor=ffffff&link=ffffcc&words=comments&title=comments &width=350&height=350'>   urllink ch.bmp  after bawling my eyes out from mike's departure this morning (that's right, he ditched alison to stay in chicago and hang with matt and me), i decided to eat a","[""emailalert=no&email=adgrant@indiana.edu&url=http://closeproximity.blogspot.com&name=proximity&bgcolor=003399&fcolor=ffffff&link=ffffcc&words=comments&title=comments &width=350&height=350'>   urllink ch.bmp  after bawling my eyes out from mike's departure this morning (that's right, he ditched alison to stay in chicago and hang with matt and me), i decided to eat a breakfast"", ""emailalert=no&email=adgrant@indiana.edu&url=http://closeproximity.blogspot.com&name=proximity&bgcolor=003399&fcolor=ffffff&link=ffffcc&words=comments&title=comments &width=350&height=350'>   urllink ch.bmp  after bawling my eyes out from mike's departure this morning (that's right, he ditched alison to stay in chicago and hang with matt and me), i decided to eat a cheeseburger"", ""emailalert=no&email=adgrant@indiana.edu&url=http://closeproximity.blogspot.com&name=proximity&bgcolor=003399&fcolor=ffffff&link=ffffcc&words=comments&title=comments &width=350&height=350'>   urllink ch.bmp  after bawling my eyes out from mike's departure this morning (that's right, he ditched alison to stay in chicago and hang with matt and me), i decided to eat a whole pan"", ""emailalert=no&email=adgrant@indiana.edu&url=http://closeproximity.blogspot.com&name=proximity&bgcolor=003399&fcolor=ffffff&link=ffffcc&words=comments&title=comments &width=350&height=350'>   urllink ch.bmp  after bawling my eyes out from mike's departure this morning (that's right, he ditched alison to stay in chicago and hang with matt and me), i decided to eat a snack"", ""emailalert=no&email=adgrant@indiana.edu&url=http://closeproximity.blogspot.com&name=proximity&bgcolor=003399&fcolor=ffffff&link=ffffcc&words=comments&title=comments &width=350&height=350'>   urllink ch.bmp  after bawling my eyes out from mike's departure this morning (that's right, he ditched alison to stay in chicago and hang with matt and me), i decided to eat a small lunch""]",0.8879916667938232,0.5177745746477154
eat,What cute animals have you eaten ?,5,eaten,animals,2,What cute,[],-1.0,-1.0
eat,Now most of you know about my rule to never eat food from gas stations (unless prepackaged) and i considered breaking that rule just to get the free song...,10,eat,food,11,Now most of you know about my rule to never eat,"['Now most of you know about my rule to never eat any type', 'Now most of you know about my rule to never eat a banana', 'Now most of you know about my rule to never eat a piece', 'Now most of you know about my rule to never eat a sandwich', 'Now most of you know about my rule to never eat ice cream']",0.793730616569519,0.18691972923100694
eat,I got many a laugh from imagining my cashier actually having to eat my chalupa if i did't enjoy it!,12,eat,chalupa,14,I got many a laugh from imagining my cashier actually having to eat my,"['I got many a laugh from imagining my cashier actually having to eat my ""goodie bag', 'I got many a laugh from imagining my cashier actually having to eat my order', 'I got many a laugh from imagining my cashier actually having to eat my money', 'I got many a laugh from imagining my cashier actually having to eat my bagel', 'I got many a laugh from imagining my cashier actually having to eat my sandwich']",0.6774443984031677,0.15567172859786546
eat,"She eats mayonnaise by the spoonful from the jar as he encourages her to go for a walk, run up the stairs, do anything to shed the pounds.",1,eats,mayonnaise,2,She eats,"['She eats up all the food', 'She eats a lot', 'She eats up her own words', 'She eats her favorite foods', 'She eats the meal']",0.5290118455886841,0.3922604773331773
eat,I was watching the today show this morning as i ate my nutritional breakfast of chocolate chip cookies and i got to wondering...why do all of those people wave like fools?,10,ate,breakfast,13,I was watching the today show this morning as i ate my nutritional,"['I was watching the today show this morning as i ate my nutritional shakes', 'I was watching the today show this morning as i ate my nutritional shake', 'I was watching the today show this morning as i ate my nutritional yeast']",0.8851321935653687,0.40800236490284925
eat,"Not so warm and fuzzy is the story of the delaware student who  urllink ate an entire bag of mushrooms, stole a car and ended up lost 300 miles away in conneticut .",15,ate,bag,18,Not so warm and fuzzy is the story of the delaware student who  urllink ate an entire,"['Not so warm and fuzzy is the story of the delaware student who  urllink ate an entire box', 'Not so warm and fuzzy is the story of the delaware student who  urllink ate an entire sandwich', 'Not so warm and fuzzy is the story of the delaware student who  urllink ate an entire bag', 'Not so warm and fuzzy is the story of the delaware student who  urllink ate an entire pie', 'Not so warm and fuzzy is the story of the delaware student who  urllink ate an entire pizza']",0.9375343322753906,0.5499288729128345
eat,"Lots of friends (yay aly) and psycho friends of my mom kickin it, playing weird games, and eating some tasty snacks.",21,eating,snacks,24,"Lots of friends (yay aly) and psycho friends of my mom kickin it, playing weird games, and eating some tasty","['Lots of friends (yay aly) and psycho friends of my mom kickin it, playing weird games, and eating some tasty food', 'Lots of friends (yay aly) and psycho friends of my mom kickin it, playing weird games, and eating some tasty snacks', 'Lots of friends (yay aly) and psycho friends of my mom kickin it, playing weird games, and eating some tasty junk food', 'Lots of friends (yay aly) and psycho friends of my mom kickin it, playing weird games, and eating some tasty shit', 'Lots of friends (yay aly) and psycho friends of my mom kickin it, playing weird games, and eating some tasty and spicy food']",0.9925550818443298,0.6375282436026859
eat,"I have to admit that i was not skeptical in terms of eating the snack because a shell just doesn't seem, well, alive.",12,eating,snack,14,I have to admit that i was not skeptical in terms of eating the,"['I have to admit that i was not skeptical in terms of eating the entire thing', 'I have to admit that i was not skeptical in terms of eating the eggs', 'I have to admit that i was not skeptical in terms of eating the whole raw food vegan diet', 'I have to admit that i was not skeptical in terms of eating the whole thing', 'I have to admit that i was not skeptical in terms of eating the meat']",0.8667073249816895,0.21766741000040965
eat,Prolly eating-literally eating *wink*,4,eating,wink,6,Prolly eating-literally eating *,"['Prolly eating-literally eating *his* popcorn', 'Prolly eating-literally eating *cough', 'Prolly eating-literally eating *food', 'Prolly eating-literally eating *his* breakfast', 'Prolly eating-literally eating *a lot*']",0.6970179080963135,0.14684677619231626
eat,"Actually, i do eat dessert.",4,eat,dessert,5,"Actually, i do eat","['Actually, i do eat meat', 'Actually, i do eat a lot', 'Actually, i do eat this dish', 'Actually, i do eat beef', 'Actually, i do eat lots']",0.44612354040145874,0.4366916896786581
eat,But i have been eating up the npr coverage of the democratic national convention.,4,eating,coverage,8,But i have been eating up the npr,"['But i have been eating up the npr news', 'But i have been eating up the npr coverage', 'But i have been eating up the npr', 'But i have been eating up the npr network', ""But i have been eating up the npr's coverage""]",0.9490690231323242,0.4053370951129347
eat,"The panadol did some magic and before long i was eating dinner and we were playing board games - entertainment without tv, reminds you of black and white days, no?",10,eating,dinner,11,The panadol did some magic and before long i was eating,"['The panadol did some magic and before long i was eating a lot', 'The panadol did some magic and before long i was eating every single morsel', 'The panadol did some magic and before long i was eating the most delicious soup', 'The panadol did some magic and before long i was eating two cakes', 'The panadol did some magic and before long i was eating the whole thing']",0.8932138681411743,0.15027554290815684
eat,Portgas d. ace...he ate the mera mera fruit and can extract and control fire at will.,5,ate,fruit,9,Portgas d. ace...he ate the mera mera,['Portgas d. ace...he ate the mera mera'],0.9558825492858887,0.03251820362386258
