lemma (V),sentence,verb index,verb text,dobj,dobj index
eat,Who wants to huddle together underground eating canned spam?,6,eating,spam,8
eat,"(safety note: concentrated hydrofluoric acid is so corrosive that it will eat its way through glass, so store it only in plastic.",13,eat,way,15
eat,If you eat too many bananas you'll get a stomach-ache.,2,eat,bananas,5
eat,"#10 many koreans have dogs as pets, but many other koreans eat dog!",13,eat,dog,14
eat,"Yup,  urllink they eat dogs here (read story if you've got a strong stomach) .",5,eat,dogs,6
eat,"In the summer months people even sleep next to the river (well, not  right  next to it) fishing, eating ramen, drinking soju, talking...typical korean stuff.",24,eating,ramen,25
eat,"One scene is with these 3 minor gangsters who are so poor they have to eat dogfood, but it gives them the runs and later (when you least expect it) a serious scene cuts to them running into a single-stall public loo.",15,eat,dogfood,16
eat,I ate the spaghetti of the wall!,1,ate,spaghetti,3
eat,The teachers din bother to stop us from eating sweets in class.,8,eating,sweets,9
eat,"i simply love fruits lor..today they wanted to go foodcourt 6, den we go lor..there got no food to eat lor..all not appealing..so fruits is just the best solution.",24,eat,lor,25
eat,wads wrong with eating tomato! heck la..den we left first..went co-op shop..damn lor..bought choc..but share..so not too bad.crunch.nice la..today class was from 9-6pm..but fruits still the best.,3,eating,tomato,4
eat,and i can't take it.plus was also considering wad to eat tml..just to lose more weight.,11,eat,tml,12
eat,i ate alot of fruits yesterday also.,1,ate,alot,2
eat,"i ate one grapefruit, 2 oranges, half a dragonfruit.",1,ate,grapefruit,3
eat,den go school..haiya..same thing la..den hor..ate lunch at kfc..super sinful..,13,ate,lunch,14
eat,"i also duno why ask her to come..cos too late le..can't do anything much..so went fc4 to eat..she eat la..not me and mandy..after eat le den we from sp walk to clementi..went to mr bean to eat tang yuan..nice la..but fattening..got tangyuan, beancurd,soya milk and syrup..",35,eat,den,37
eat,i ate 3 tangyuan den mandy help me eat the last one..den we take bus to eunos den from there take mrt..hai..slept on the bus..really too tired..,8,eat,one,11
eat,"i've been eating soooooo much lor..since tue till today..genki sushi on tue, ljs+ice cream yesterday, den today kfc+tangyuan..cannot la..if this goes on, sure die de..but i duno",3,eating,lor,6
eat,"i say i didn't eat alot..eat fish soup, a lot of fruits..he say i cannot take oily food(i hate oily stuff, so fattening!), no milk(stopped drinking that too..fattening)..strange lor..how on earth did i get food poisoning!",5,eat,alot,6
eat,"i say i didn't eat alot..eat fish soup, a lot of fruits..he say i cannot take oily food(i hate oily stuff, so fattening!), no milk(stopped drinking that too..fattening)..strange lor..how on earth did i get food poisoning!",8,eat,soup,10
eat,i and theo always eat watermelon..from same stall oso..,4,eat,watermelon,5
eat,cos i only haven't been eating carbo for like 1 week...,6,eating,carbo,7
eat,really cmi la..  stay at home only can rot..i tried eating today..din vomit.but super bloated..mabbe cos of the ribena..wanna die liao..my last meal was at 10+am..but till now not hungry at all..i wanted to eat watermelon..but dropped it..there goes my fruit.,50,eat,watermelon,51
eat,Yesterday ah..i was sick lor..duno why also..mabbe lack carbo..havent been eating carbo for a few days.,18,eating,carbo,19
eat,Didn't eat breakfast.,2,eat,breakfast,3
eat,"add to this the effects of returning to training after an extended bout of laziness, and we have a recipe for why i am only just surfacing now to eat the chocolate muffin left for me.",30,eat,muffin,33
eat,plans for today: call evil car hire firm call non-evil laura eat non-evil food pay evil credit card bill maybe even go outside   the world is my (non-evil) lobster.,14,eat,food,18
eat,"also, i have a friend who (i suspect) may need help eating that tub of ice cream...",14,eating,tub,16
eat,"the manchester cow parade   slaps: indigestion from eating toast and rice too quickly   (sheesh...)  and no, i'm *not* in a mood...  n.",9,eating,toast,10
eat,five in the afternoon is not a good time to be eating breakfast.,11,eating,breakfast,12
eat,"oh, alright then, but she's done backing vocals with  urllink weezer  and jimmy eat world, and that's good enough for me.",18,eat,world,19
eat,"other news is that the solid block of sugar that has been threatening to fall out of my sugar tin finally did so into one the most enjoyable cups of coffee i've had in a while, i am almost out of maple syrup on account of eating popcorn for most meals, and i have been thinking about happiness some more.",48,eating,popcorn,49
eat,I'm at work eating lunch right now.,4,eating,lunch,5
eat,"I did something, ate dinner, blaa blaa for the next few hours untill it was almost time for bed.",4,ate,dinner,5
eat,"Anyways, am eating butter and sugar on bread right now - the poor man's brekky hehe.",3,eating,butter,4
eat,I mean the last place i worked at was so anal about making money it charged its employees if they wanted to eat the food there!,22,eat,food,24
eat,"There once was a girl from doncaster who liked to eat chips, wood and plaster she fell ill one day got taken away leaving her house looking somewhat lacklustre   geddit?",10,eat,chips,11
eat,She was eating her house that's why she was ill and...and... (silence from the audience),2,eating,house,4
eat,The things she said...  'did you know that how you hold your chopsticks means how far away your future partner is?'  'did you know that you can eat the fish's bones?,34,eat,bones,38
eat,"Food alert  am reading a book charles  lent to me called  eat chocolate, drink alcohol and be lean and healthy  by andrew jobling.",14,eat,chocolate,15
eat,"Watching your glycemic intake, eating smaller but more frequent meals, among other things.",5,eating,meals,10
eat,Eating the leaves will clear you brain.,0,Eating,leaves,2
eat,"i was so hot, but my belly is full and that is a good thing, however eating salad while breathing through your mouth is a hard thing to do and not choke.",18,eating,salad,19
eat,"I don't even remember the last time i saw her but it was probably at our north carolina family reunion, eating chicken stew cooked in a large cast iron kettle over an open flame.",22,eating,stew,24
eat,"Then, this guy that i adore,went on to tell me that at the last mac expo (or whatever) when steve jobs gave his closing statement, he had a friend over to his house during their lunch hour and they watched it on the internet while eating macaroni and then for dessert they had applesauce.",51,eating,macaroni,52
eat,"Jaques costeau • les mis (though in french it would be lost on me) • jean-marc gaspard itard and the wild boy of aveyron • matisse, degas, la tour, cezanne, monet, rodin, renior, to name a few • joan of arc • “let them eat cake.”",56,eat,cake,57
eat,The drinks flowed and good food was served and we ate dinner overlooking a lake at sunset.,10,ate,dinner,11
eat,Eat krackle' advertising campaign.,0,Eat,campaign,4
eat,I have to stop eating chinese food.,4,eating,food,6
eat,Well i eat too much chinese food:  you make people realize that there exists other beautise in the world.,2,eat,food,6
eat,"It's not like i made a chess set carved out of white potatos and sweet potatos that have been fried, so that as you win you can eat french-fried bishops and rooks and pawns.",29,eat,bishops,33
eat,I'll leave you with a song:  kookaburra sits on an old gum tree merry merry king of the bush is he laugh kookaburra laugh kookaburra gay your life must be   all together now   kookaburra sits on an old gum tree eating all the gumdrops he can see stop kookaburra stop kookaburra save some gums for me   one more time!,45,eating,gumdrops,48
eat,"(which is how i still eat the stuff, and where i got my fondness for sucking stuff.",6,eat,stuff,8
eat,"So then 3 days latter,john, was getting pretty fed up of eating pokemon so he went out of the forest and desided to find ash(the star of the t.v series) he found him playing with pikahu on a park bench in the city.",14,eating,pokemon,15
eat,He eats grass  11.),1,eats,grass,2
eat,Hey john. n/m which one of u ate the c-gob.,10,ate,gob,14
eat,they all sit and eat the candy.,4,eat,candy,6
eat,4the next 100 years they ate  cotton candy and played 20 qwuestions.,5,ate,candy,8
eat,He builds fences with beaver eaten twigs.,5,eaten,twigs,6
eat,"'i'm not a animal, i don't eat my own crap!'",10,eat,crap,13
eat,saying that he could eat more meatloaf then john.,4,eat,meatloaf,6
eat,bo ate 15 loaves and john ate 3.,1,ate,loaves,3
eat,they were eating magical cheesecake and real cherries from the garden outside.and-2. bo smelled really bad.,2,eating,cheesecake,4
eat,"Apparently, people are eating the book up.",4,eating,book,6
eat,At least marketing takes up very little brain cells...it just eats up pride.,12,eats,pride,14
eat,"Jamie brought a plastic bag full of candies that keeps all of us happy during the game (it's kinda slow for me and there only was one homerun by the astros and they switch the pitcher, clemens, in the middle of the game, but still it's interesting)so yesterday i just ate four candies, drank a bottle of milk and a bagel for lunch and one plate of egg salad after i got home.",56,ate,candies,58
eat,"Whenever i feel hungry while i'm sleeping, i always dream about eating some foods and wake up feeling even hungrier.",13,eating,foods,15
eat,"I dream of eating my home country food with my family and i started eating the food with silverwear but after a while i use my hand to eat the food instead of the silverwear, and it felt really good.",3,eating,food,7
eat,"I dream of eating my home country food with my family and i started eating the food with silverwear but after a while i use my hand to eat the food instead of the silverwear, and it felt really good.",14,eating,food,16
eat,"I dream of eating my home country food with my family and i started eating the food with silverwear but after a while i use my hand to eat the food instead of the silverwear, and it felt really good.",28,eat,food,30
eat,"My day pretty much consisted of going to church, eating lunch, and playing ffxi.",10,eating,lunch,11
eat,"Wake up, go eat lunch, and then come home and post this.",4,eat,lunch,5
eat,"So, i get out of summer school today to go eat lunch.",11,eat,lunch,12
eat,"The terminal (won't be getting on dvd since it's not a movie i'd watch all that often, but it was still good)  spiderman 2  king arthur  i, robot  the bourne supremacy  catwoman   about time to eat lunch",48,eat,lunch,49
eat,He waited as patiently as he could and got out the cereal box to eat his breakfast calmly.,14,eat,breakfast,16
eat,how do you eat an apple?,3,eat,apple,5
eat,Eat an apple or an orange?,0,Eat,apple,2
eat,"But i would do it again in a heartbeat, as long as i didn't have to eat any more caviar!",18,eat,caviar,21
eat,"The thing is, you can’t depend on someone every leg, and you won’t be number one on the finishing line just because you can eat caviar.",28,eat,caviar,29
eat,"I know you’re all frustrated at having to eat salt, but no need to take it out on your boyfriend and another team!",9,eat,salt,10
eat,"As the only other guy to have eaten the caviar, you really let your team down by doing it so much slower than chip.",7,eaten,caviar,9
eat,"Joyce ate the caviar fast, and she can be counted as a prom queen cause she’s a skinny female.",1,ate,caviar,3
eat,"I was a little trashed, on the way home ate 3 burgers (thats so gross) and so began a bad spell of late night eating binges.",10,ate,burgers,12
eat,You want to eat lunch as soon as you can.,3,eat,lunch,4
eat,Vicky and i ate a lot of chicken and hot dogs.,3,ate,lot,5
eat,Then we goofed off for a while and ate some dinner.,8,ate,dinner,10
eat,"Im getting really sick again, because i ate a pop-tart.",9,ate,tart,13
eat,Name four things that you have done today: - managed to get out of bed at 11:00 - go to the store - spend pointless hours online - eat a pop tart.,29,eat,tart,32
eat,Jimmy eat world - 'the sweetness' 7.,1,eat,world,2
eat,Jimmy eat world - 'the sweetness' 7.,1,eat,sweetness,6
eat,"i ate pop tarts, which was a positive, but the best part was emma was doing all of her dances for us and hannah was attempting them too.",1,ate,tarts,3
eat,day1: it was tight cuz we just kinda chilled at our coaches house and ate a lot of food and watched van wilder.,15,ate,lot,17
eat,Woke up at 9am...ate breakfast (which lyn made for me and amanda...it was goooood) then went swimming,5,ate,breakfast,6
eat,I had killed and eaten another human being...,4,eaten,being,7
eat,the need for human flesh and blood...and now there's no way back.....suicide just doesn't work....eating other people makes you stronger.....strong enough not to die...and now i have to live with this....without having the strength to control myself..to end this up....because it moves me...it controls me...,22,eating,people,24
eat,"After all, when you return from a trip to israel, you will invariably be asked by many people whether or not anything happened, and by the way the question is formed, you know they're not asking whether or not you got sick from eating too many dates.",48,eating,dates,51
eat,so i went to the fridge and had some olives...then i ate a half a spoon ful of butter cuz i was craving that..it smelled good.,13,ate,ful,18
eat,okay so its coming on lunch time and i havent eaten breakfast...there is a spider in the kitchen and i wont kill it...i'm not going near it.,11,eaten,breakfast,12
eat,Tunafisher88: u sound like a 45 year old lady running a day care in a trailer tunafisher88: talking to the little kid who ate the glue  that was fun...,25,ate,glue,27
eat,I job shadowed missy at work for a couple of days and this is a picture of missy eating her breakfast from a paper cup.,18,eating,breakfast,20
eat,but i can eat delicious foods...,3,eat,foods,5
eat,so save me a space on your sofa - i'm going to write and make documentaries and  eat dryer lint.,19,eat,lint,21
eat,Eat you up some hanover tomatoes for poor little old homesick me.,0,Eat,tomatoes,5
eat,I will not eat this plate of broken glass no not me,3,eat,plate,5
eat,It was true that omar would not eat pork.,7,eat,pork,8
eat,"I don't eat pork,'' omar said.",3,eat,pork,4
eat,He says he ate his first complete meal in days and cleaned his cell.,3,ate,meal,7
eat,I'm about to go eat breakfast with my future husband.,5,eat,breakfast,6
eat,Happy thanksgiving everyone!  eat lots of toast and popcorn!,5,eat,lots,6
eat,i am going to eat a candy bar not just any bar a *candy* bar a bar made entirely of candy nothing else just candy in the shape of a bar a bar of candy a candy bar all candy nothing but candy shaped like a bar bar-shaped candy pure candy molded into a bar a candy bar a bar which consists entirely of candy a candy bar,4,eat,bar,7
eat,i am going to eat a candy bar not just any bar a *candy* bar a bar made entirely of candy nothing else just candy in the shape of a bar a bar of candy a candy bar all candy nothing but candy shaped like a bar bar-shaped candy pure candy molded into a bar a candy bar a bar which consists entirely of candy a candy bar,4,eat,candy,26
eat,i am going to eat a candy bar not just any bar a *candy* bar a bar made entirely of candy nothing else just candy in the shape of a bar a bar of candy a candy bar all candy nothing but candy shaped like a bar bar-shaped candy pure candy molded into a bar a candy bar a bar which consists entirely of candy a candy bar,4,eat,bar,39
eat,i am going to eat a candy bar not just any bar a *candy* bar a bar made entirely of candy nothing else just candy in the shape of a bar a bar of candy a candy bar all candy nothing but candy shaped like a bar bar-shaped candy pure candy molded into a bar a candy bar a bar which consists entirely of candy a candy bar,4,eat,bar,63
eat,but i was told that i could let my daughter eat fatty foods and hold someone else accountable...,10,eat,foods,12
eat,"I still prefer living in the heathen us, wearing my holy blue jeans, ratty old t-shirt, eating my cheeseburger, deep fried potatoe strips, and watching american football on tv, or better yet, laughing at some of the ugly dresses the actresses wear to all the awards shows.",21,eating,cheeseburger,23
eat,"They take their time in preparing their food, eating their food, living their lives.",9,eating,food,11
eat,"I think we as americans are always go go go...eating instant foods, full of preservatives, shoving them in our gullets as quickly as possible so we can go go go some more.",11,eating,foods,13
eat,ate some watermelon.  with salt.,0,ate,watermelon,2
eat,"now i want to sing, eat pudding pops, and burn books!",6,eat,pops,8
eat,he ate food.,1,ate,food,2
eat,"She also usually will eat cheese when it is offered, and she eats a peanut butter and jelly sandwich for lunch.",4,eat,cheese,5
eat,"She also usually will eat cheese when it is offered, and she eats a peanut butter and jelly sandwich for lunch.",13,eats,butter,16
eat,Were you too busy eating freedom fries to realize that countries have the freedom not to side with the us when it does bad things?,4,eating,fries,6
eat,somebody best give me a job soon or i'm going to eat some pudding pie!,12,eat,pie,15
eat,"the reason i didn't go off about mad cow is because everyone here already knows the risks of eating meat, the opinions that the vegans/vegetarians have, and have already made up their mind.",19,eating,meat,20
eat,i would love it if people would just eat meat every 3 days instead of every day.,8,eat,meat,9
eat,"In spite of my ignorance, i saw many other paintings that captured my attention and ate my memory card of the camera!",16,ate,card,19
eat,"Do you eat pork, beef and things like that?'.",2,eat,pork,3
eat,Vegetarians eat fish.,1,eat,fish,2
eat,I don’t take it'. 'how come you do you eat these bland things with not much taste?'.,13,eat,things,16
eat,i tried to eat more veggies.,3,eat,veggies,5
eat,"so i get angry..and thought, i'll just eat breakfast, and not pack anything..",11,eat,breakfast,12
eat,so i finally ate my cereal and went to school (all this happened in less than 30min) crazy..,3,ate,cereal,5
eat,I have eaten  the plums that were in the icebox  and which you were probably saving  for breakfast  forgive me they were delicious so sweet  and so cold  a poem by william carlos williams.,2,eaten,plums,5
eat,"Lieszche and i went to see princess diaries 2 yesterday and ate $40 worth of coke and candies and shit, and got hyper-glycemic, and thoroughly enjoyed ourselves.",11,ate,worth,14
eat,I felt ripped off but that's ok because we got all you can eat crab legs for $15.,14,eat,legs,16
eat,Rachel ate over 5 lbs of friggin crab legs....,1,ate,lbs,4
eat,but it was late)  sunday: - connected and networked carlene's mom and sister's computers to the web - watched the laker game - bought and ate bravo burger (all hell broke loose),30,ate,burger,32
eat,"I woke up and took the role of couch potato, then talked to a few friends by way of keyboard, and then ate some food.",24,ate,food,26
eat,I just ate dinner.,2,ate,dinner,3
eat,And eat hotdogs.,1,eat,hotdogs,2
eat,My dad took my entire family out to eat lunch.,8,eat,lunch,9
eat,"You can go play something outside until it gets dark, then you can come inside, eat dinner, take a shower or whatever, and it's already time to go to sleep!",17,eat,dinner,18
eat,"Today my family and i went to mazzio's to eat pizza (oh, who 'da thought?) and cake.",10,eat,pizza,11
eat,"I had the big chicken all you can eat thing, but i didn't have anything for breakfast so the rfried beans didn't taste all too apetizing.",8,eat,thing,9
eat,"After we sort of ate the food, genny's drink was taken away by the waitress so she could get a refill.",4,ate,food,6
eat,"Drive safe, eat lots of barbecue, dont use illegal fireworks and blow your hand off, and all that good stuff.",3,eat,lots,4
eat,"They drove me to milpitas and i got to eat  halo-halo  (hadnt had that in yearsit was so yummy!), crab, lots of pork (cant be filipino and not eat pork!),  dinuguan  (chocolate meat) and  daing",9,eat,halo,13
eat,"They drove me to milpitas and i got to eat  halo-halo  (hadnt had that in yearsit was so yummy!), crab, lots of pork (cant be filipino and not eat pork!),  dinuguan  (chocolate meat) and  daing",40,eat,pork,41
eat,"I know i'm depressed when i eat shitty foods and all i want to do is sleep (or my sleeping habits change--i've been falling asleep at 10:30 pm the past few nights, and waking up at 2 or 3 am, then going back to sleep til abouta 7 am) or shop.",7,eat,foods,9
eat,Ive eaten my dads cooking and my aunties,2,eaten,dads,4
eat,"I think a lot of filipinos might feel the same waythat you shouldnt bother eating filipino food at  turo-turo  (literally point-point where the food sits pre-cooked, stewing under a heatlamp) mom-n-pop joints.",15,eating,food,17
eat,"I need to try their  halo-halo ,   turon ,  sinigang  and  lechon  (cant be filipino and not eat pork!)",27,eat,pork,28
eat,"I like to eat my pho with rare beef, tripe, and tendons.",3,eat,pho,5
eat,You cant be asian and not eat pork or some kind of organ meat.,7,eat,pork,8
eat,"Yvette picks on me like, youre half  ilocana , thats why you eat some nasty shit.",16,eat,shit,19
eat,"( day, magkapareho din tayo, di ba? )  growing up, i was disgusted by how my mom and dad would eat shrimp.",25,eat,shrimp,26
eat,He eats fish heads fast and clean like a pro.,1,eats,heads,3
eat,"Nowadays when i visit my auntie baby and we eat shrimp  kamayan  style (with your hands, like a peasant), i suck on shrimp heads too.",9,eat,style,14
eat,I also used to be really horrified at the thought of eating  balut .,11,eating,balut,13
eat,"Back in the day, taek would say hes more filipino than me because hed eaten  balut",17,eaten,balut,19
eat,"In the meantime, he's living in his girlfriend's house, driving her car, sleeping in her bed and eating her food.",22,eating,food,24
eat,"Since then i have eaten candy, chewed gum and neglected to floss on a regular basis.'",4,eaten,candy,5
eat,"Instead of repenting, telling her husband the truth and seeing the error of her ways, she decides to eat arsenic and kill herself.",20,eat,arsenic,21
eat,"She's sitting at her desk, eating her lunch.",7,eating,lunch,9
eat,"I don't know about you, but on those occasions when i do eat lunch at my desk, i do not, under any circumstances, answer my phone.",14,eat,lunch,15
eat,Then she makes sure she mentions to the caller that 'you caught me eating my lunch at my desk.',14,eating,lunch,16
eat,"I ate way too many jelly beans and york peppermint patties, resulting in a sugar headache that would have made even candy genius curl up in the fetal position.",1,ate,beans,6
eat,"Heard in the office today: 'i don't want to freak you out, but mike tyson is eating the garnish off your banquet table on the terrace.'",20,eating,garnish,22
eat,My camera eats batteries at a ridiculous rate.,2,eats,batteries,3
eat,"Random thoughts and simple joys  why is that, when i was in my twenties i could eat a pint of ben & jerry's every day, and managed to weigh about 20 lbs less than i do now.",18,eat,pint,20
eat,eaten an entire box of oreos?: not in the past month eaten sushi: no been on stage: no  been dumped: no gone skating: no made homemade cookies: no gone skinny dipping: no dyed your hair: yes stolen anything: no you sound boring: no   layer seven  ever...  played a game that required removal of clothing:,0,eaten,box,3
eat,eaten an entire box of oreos?: not in the past month eaten sushi: no been on stage: no  been dumped: no gone skating: no made homemade cookies: no gone skinny dipping: no dyed your hair: yes stolen anything: no you sound boring: no   layer seven  ever...  played a game that required removal of clothing:,13,eaten,sushi,14
eat,"I'm going to blame it on mars, eat a pint of ben & jerry's tonight and just move on.",9,eat,pint,11
eat,"I get to do good by helping others, bring cultural awareness to the city, eat good food, shop, see great cultural performances, and enjoy the eye candy as well.",16,eat,food,18
eat,"Just watch the movie and eat your popcorn, and shut up already.",5,eat,popcorn,7
eat,"Of course, my legs have never (and if i have any say in it, will never) eaten a rib, drunk lemonade, or even seen james bond.",20,eaten,lemonade,25
eat,"To all you sco stock holders, a word of advice: eat the loss and sell now.",12,eat,loss,14
eat,"When they don't have food to eat, they like to eat things that are not food and they chew on wires.",12,eat,things,13
eat,grrr... want to eat me izzit...,4,eat,izzit,6
eat,"didnt had anithing to eat 4 my breakfast but still didnt tell my little teddy .. waited for my bro to come back (around 1) b4 i could have sth to eat.. had instant macoroni and felt so full... as usual, when my bro comes back i wont have anithing to do as the com and tv will be occupied...",5,eat,breakfast,8
eat,dad brought home kfc yay... ate half the potato and 2 chickens.. that was abt 6 plus so had late dinner ( not exactly.. around 8) was kinda of full so din eat much..,6,ate,potato,9
eat,"grrr... reached home bathed 4 an hour, ate instant noodles... watched television for  pathetic 30mins (well its better than nothing)..",9,ate,noodles,11
eat,Although i have been doing all this exercise i wanted to eat an ice cream today.,11,eat,cream,14
eat,"I know, i believe i have farmers genes (that's genes as in chromosome type things not, as my mother thought, farmers jeans, when i told her) i went to the allotment yesterday and picked peas and beans and ate a few strawberries too.",45,ate,strawberries,48
