lemma (V),sentence,verb index,verb text,dobj,dobj index
eat,"Each day, i listen to conversations about money and deals and contracts and money, then scotch whiskey on fridays and weekends of parties in which rich lawyers who work 24 hour days play golf or eat lobsters flown in from nova scotia and think about nothing at all because they can't any more.",37,eat,lobsters,38
eat,"in losing my spirit, i eat money and deals, mergers and wheels  and my poetry, never good, now hurts to read.",6,eat,money,7
eat,i would eat the cherries in kyoto as the sun traps my silence in the fur of your tongue.,2,eat,cherries,4
eat,"you called me by the morning rain, a right animal without road killing, eating the leaves from your land.",15,eating,leaves,17
eat,"i'd be here for you as a butterfly for its cocaine, watching the blue moon eat the sunrise into eternity.",17,eat,sunrise,19
eat,this is a bad omen as bad as the dog eating the sweet bird.,10,eating,bird,13
eat,By brendan�i.�koerner  eat salt,7,eat,salt,8
eat,kindle the fire of desire and then eat a fat roasted pig.,7,eat,pig,11
eat,it is no sin to eat that apple eve couldn't  wait to taste.,5,eat,eve,8
eat,forgive me i wanted to eat the pomegranate seeds now with you,5,eat,seeds,8
eat,"be not the soldier  that arms herself  with fear    let them like chopin and together eat cake   the guillotine awaits  those who withhold bread    for truth, for art: alta, alta...and away...",18,eat,cake,19
eat,"i've ever read...since, i always stand in my 'sunlit doorway' taking in the heat, eating my meat, watching the men prepare their fleet...hazel green, so obscene.",21,eating,meat,23
eat,"we'll get you to where you want to go: aver chary relax contrite  elegant giraffe, quashing the competition, piercing the leaves with gladness, eating the sound of music with fierceness, mordecai and esther with the lots, trannies, tarot and baby carrots, sweet crackers and white dresses that mean to be green  virgin",29,eating,sound,31
eat,"If you think this is some sort of discrimination then i believe you need not look any further than a general census percentage to see that people who eat meat are, in fact, in the norm.",28,eat,meat,29
eat,so we went to basment of paragon to eat tori-q..,8,eat,tori,9
eat,then we ate dinner and watched a movie.,2,ate,dinner,3
eat,i ate dinner in my room tonight cuz my sis was downstairs with her bf.,1,ate,dinner,2
eat,whats happened today and yesterday....  slept ate (pudding and jello pretty much...and it doesnt fill you up too much)  thats about it...alot of tv watching time too...it doesnt sound bad but when u have like 5 stitches through your lip and your nose hurts without anything even touching it and you cant move one fourth of your mouth...not too great haha.,9,ate,pudding,11
eat,so we ate dinner in which the cake sucked...,2,ate,dinner,3
eat,eating breakfast and trying to be busy.,0,eating,breakfast,1
eat,We ate a late lunch at grandma's and visited some more before heading back to pick up ked.,1,ate,lunch,4
eat,I did a double take as i realized a squirrel was sitting on his head eating the corn the gentleman was setting on the bill of his hat!,15,eating,corn,17
eat,"Actually, i think everyone eats pretty well the rest of the week and we all just decided that thursdays nights is the time to cut loose, or something!",5,eats,rest,9
eat,We recently discovered that the love bugs were genetically engineered by the univ of south florida to eat mosquito larvae.,17,eat,larvae,19
eat,After swinging through a couple cool but kinda cheesy tourist shops we ate a nice picnic lunch in the park and then headed to casperson beach to hunt for shark's teeth.,12,ate,lunch,16
eat,He said he had to savor the moment with a cup of coffee and took his time eating his slice.,17,eating,slice,19
eat,We ate a whole bag of reeses pieces and we're both way too sugared up.,1,ate,bag,4
eat,"We don't eat much sugar anymore, and that was way overdose.",3,eat,sugar,5
eat,"At least i know there will be a few nights he won't be eating macaroni & cheese, frozen burritos and pizza!",14,eating,macaroni,15
eat,Today while eating my lunch i turned on pbs and caught the ending of a program that profiled families who gave up the 21st century for five months to homestead in montana.,2,eating,lunch,4
eat,"It was ironic that i was telling kedron about this thought over dinner and not long after we finished eating our power went off again, thanks to another storm.",19,eating,power,21
eat,After nina's house we went to el superior to eat cheese enchiladas for lunch.,10,eat,enchiladas,12
eat,We ate dinner and watched vegas vacation.,1,ate,dinner,2
eat,i ate: a sausage.,1,ate,sausage,4
eat,"i ate: ice cream for breakfast (it's the only thing to eat in gator's house, i swear!), nacho italiano doritos, and sprite remix for lunch.",1,ate,cream,4
eat,i ate: coffee.,1,ate,coffee,3
eat,"So we ate spaghetti, while my dogs jumped in and out of the dining room window, and my neice and nephews charmed barbara, and kevin, and maaayybee laura.",2,ate,spaghetti,3
eat,"We got home and ate ice cream, and sour candies.",4,ate,cream,6
eat,"shouldn't i live in an igloo, and eat seal meat, and shoot whales????",9,eat,meat,11
eat,"I ate cereal for brekkie, fires for linch (approximately six of them) and half of a hotdog, and some grapes for dinner.",1,ate,cereal,2
eat,"i ate: coffee, noodles, pancakes, coffee and hamburger helper.",1,ate,coffee,3
eat,"i ate: coffee, popcorn, and a lot of water.",1,ate,coffee,3
eat,"i ate: coffee, and a casserole-like thing with noodles, and chicken.",1,ate,coffee,3
eat,"We ate some pizza hut there, and i had an enormous mocha latte which was very very yummy.",1,ate,hut,4
eat,I ate grapes while listening to mom and auntie barb.,1,ate,grapes,2
eat,"So i had to smile, and be nice, and eat lots of tic tacs.",11,eat,lots,12
eat,"Out of the entire meal i ate one bite of the filet mignon, four bites of the potatoes, and one strip of broccoli.",6,ate,bite,8
eat,"I ate chili, and chocolate milk, and coke, and it all tasted better than anything i'd had in the states.",1,ate,chili,2
eat,i ate: coffee.,1,ate,coffee,3
eat,"i ate: spaghetti for lunch, and dinner oddly.",1,ate,spaghetti,3
eat,"i ate: coffee, thai kitchen, and grape soda.",1,ate,coffee,3
eat,Woke up at 7.30pm to eat my dinner!!,5,eat,dinner,7
eat,"After jamming, we went to eat roti prata.",6,eat,prata,8
eat,"Whle eating roti prata, we watched the video that darius, teh fcuking great videoman, took of us jamming... 40+ mins including the video-ing of the ij chix.",1,eating,prata,3
eat,"Lol. reached home at about 7.15pm, ate my dinner and slept till 10pm.",8,ate,dinner,10
eat,"Anyway, after billiard, we went bk and ate the whopper meal ~ $3.90 for the meal.",9,ate,meal,12
eat,"While waiting for their lessons to end, i went over to liang court and ate macs.",15,ate,macs,16
eat,i ate a shizzload.. sinful!,1,ate,shizzload,3
eat,haha i sound like such a glutton.. eating cheese fondue.. pizzas.. and *gasp!* rabbit meat!,8,eating,fondue,10
eat,Does anyone else feel obliged to eat an evening meal when your partner comes home hungry and tired.,6,eat,meal,9
eat,"And when the last fish caught, the last tree cut the last animal stuffed and put on display man will realize he can't eat money look up again there is the sun, wallowing in an oily haze of pollution look ahead again an incoming smog is rolling around break-out the gas masks and the goggles we are getting to the place we are headed dead-end, no passing go, collect your goddamn cash for the last time only footprints left between the railroad ties.",25,eat,money,26
eat,"Okay, humans, i am off to eat rice.",8,eat,rice,9
eat,"And no, i am not eating a sweetened animal.",6,eating,animal,9
eat,My cell phone message gives the impression that i am about to eat the caller and i feel brain-dead from the psat workshop where my mind broke on the last test section and elise is the messenger who bespoke of haemon's final look toward antigone and rumors fly like bats and autumn is tumbling inward and why in hell am i writing this?,12,eat,caller,14
eat,"I ate fish n' chips (spelled with a n', damnit) with malt vinegar.",1,ate,chips,5
eat,Then i suffered some type of convulsion when i realized i was eating my fish  n'  chips (fries) off a newspaper.,12,eating,fish,14
eat,"Nee!  school's fine, homework's fine, piano's not to fine but getting there, my friends are fine, why the bloody heck is this sounding like a summer camp note, i ate dinner at an english pub recently, my brother has a friend over who harasses me, i practically died this morning trying to awaken for the psat workshop, the cat is attacking my stocking feet to gain attention, the psychiatrist has the power to send me into a mental institute, i am avoiding about five different long-term projects right now, my heart skips for some reason, there is an army of plague-spreading skeletons from the reign of king arthur rising from the kitchen sink (how did they get to tennessee?), and i am arguing with the voices in my head.",39,ate,dinner,40
eat,"Elise made me (she really did make me) eat a pickle, and, like i maintain, it was disgusting.",10,eat,pickle,12
eat,I want a friend to keep me company and eat cookie dough with.,9,eat,dough,11
eat,Or it may be from eating protein bars.,5,eating,bars,7
eat,"Not hungry right now, while everyone is eating my recipe of shrimp/chicken pasta.",8,eating,recipe,10
eat,"Where are we going to get not eating carbs, aka, one of the most important molecules in your body?",7,eating,carbs,8
eat,"If one is so anxious about eating carbohydrates, let him/her choose unrefined sugars at least.",6,eating,carbohydrates,7
eat,"Eating vanllina ice cream with low-fat high-sugar hot fudge, thank you.",0,Eating,cream,3
eat,"To start, my first quote today is:  ' eat my shorts! '",11,eat,shorts,13
eat,"There's always fat kat who eats alfie's breakfast, the greedy moose.",6,eats,breakfast,9
eat,"But found 3 pieces of gold, better than eating burger and fries.",9,eating,burger,10
eat,"I rushed back to the office, ate a bit of lunch (it's an important meal, y'know?!), and head back to the office.",7,ate,bit,9
eat,i eat bugs and roaches!exotic!,1,eat,bugs,2
eat,"we ate chinese food in front of the tv and watched the fireworks from the window - what a blast (ha ha) - however, it did start off with a family blowout regarding what else - money - she owes this one money - he has the car - she wont give up the money and some bill hasnt been paid...",1,ate,food,3
eat,"Just a little background story, we believe our dog ate half the body and left the head in her house for dinner.. sick!!!",10,ate,body,13
eat,"More than 100 residents of jap road and supporters of their effort to maintain its name gathered at an open-air bar on wednesday evening to drink beer, eat barbecue and ponder how to thwart their opponents.",30,eat,barbecue,31
eat,"I must realize that my body is trying to tell me something (relatively constant indigestion, hunger not just being hungry but almost cramped pain but inability to eat large amounts of food, plumbing problems & smells).",29,eat,amounts,31
eat,Another 4 or 5 hours later we're eating meat sticks and having one last beer before the trek back to city.,8,eating,sticks,10
eat,"I tried eating ice-creams, lots of ice-cream etc.",2,eating,creams,5
eat,"Twenty minutes into the bus ride, i reeeaally regreted eating my eggs earlier.",10,eating,eggs,12
eat,"The average icelander ate 53 kilos of sugar, the average magnus and vegard (swedish and norwiegan persons) ate 43 kilos and 33 kilos each danish and finnish person.",3,ate,kilos,5
eat,"The average icelander ate 53 kilos of sugar, the average magnus and vegard (swedish and norwiegan persons) ate 43 kilos and 33 kilos each danish and finnish person.",20,ate,kilos,22
eat,"Thank goodness i don't have to eat those shitty, cold eggs on a bap anymore.",7,eat,eggs,12
eat,"About an hour later (around 2-3) i called one of my friend, who had gone to see other friends, but he was home, another friend was barely alive, for to much alcahol, since he was with his girlfriend i decided to leave and went to other bars but with little success, so i called a friend who had offered to pick me up we went to eat some drunk food which is so much better than bcn.",76,eat,food,79
eat,"Managed to survive however and had a nice family din dins on the last night to celebrate various bdays (ma and pa have theirs on the same day which makes for an expensive time of things, just found out i have an exam on the very day :o( )  i did manage to get a new charger for my camera which was what was wrong, i think edgar tried to eat my old one so it is now back in action.",75,eat,one,78
eat,The biggest thing in this letter is that there are so many wrong things in it also it doesn't have all the facts like that we are fishing 45 whales out of (if i remember correctly) 6.000 and that they do eat a lot of fish away from us.,44,eat,lot,46
eat,"If a vegetarian eats vegetables, what does a humanitarian eat?",3,eats,vegetables,4
eat,Conspiracy buffs are going to eat this movie alive..,5,eat,movie,7
eat,(i don't eat meat cause i'm not into flesh),4,eat,meat,5
eat,"Someone should be forced to stay up all night long, then forced to eat sand, then forced to hang out in the (e)xile breakroom...and then of course given a hearty beatdown!!!!!!",14,eat,sand,15
eat,I ate calamari for the first time in a fancy italian restaurant there and had an anaphylactic reaction.,1,ate,calamari,2
eat,I wasn't able to eat more than a couple of bites that day.,5,eat,couple,9
eat,The whole downhill slide after edward scissorhands and what's eating gilbert grape.,10,eating,grape,12
eat,"But, sometimes you just gotta eat real food.",7,eat,food,9
eat,-- eaten sushi: i wish!,1,eaten,sushi,2
eat,Ate some good food.,0,Ate,food,3
eat,"I'm an avid reader, and always have my nose in a book when i'm eating lunch.",17,eating,lunch,18
eat,"So there i sit, eating my lasagna, sipping my water, reading my book...and here comes someone.",5,eating,lasagna,7
eat,You know how to eat an artichoke.,4,eat,artichoke,6
eat,eh.. these days i also eat a lot of proteins..,6,eat,lot,8
eat,every recess i ate 1 chicken drumstick.. then i put on 1 kg lor!,3,ate,drumstick,6
eat,And then we settled in and my mom's friends took us sightseeing and eating lots of good food.,14,eating,lots,15
eat,"On the other hand, i was really torn because i also wanted to eat a lot of taiwanese food, which you either can't find or can't find it made correctly in the u.s. (boba tea made properly tasted so much better.)",14,eat,lot,16
eat,In 1997 ivillage was on an acquiring binge and ate up parentsplace.,9,ate,parentsplace,11
eat,ate some leftover dishes (left for me) and went back to sleep till 930am.,0,ate,dishes,3
eat,"Drexel, the other pgsit school, was already there eating lunch.",10,eating,lunch,11
eat,You really can't expect much more when eating wings.,8,eating,wings,9
eat,Woke up around 11 and then went to pollock to eat breakfast.,10,eat,breakfast,11
eat,Woke up and ate lunch at gram o'leary's.,3,ate,lunch,4
eat,"I didn't do much that day before 3, basically sat around the house and ate gummy stuff.",16,ate,stuff,18
eat,"Now, for as long as i exist on paper, i will continue to eat trees to sustain myself.",15,eat,trees,16
eat,"For when there are no trees left, math will be dead, the tree eater will again have to eat giant insects, and nudists will rule the world.",20,eat,insects,22
eat,"So remember all of you, continue to eat trees, do no math, and curse all nudists until they abandon their plans for world domination and become docile non-math doing tree eaters once again.",8,eat,trees,9
eat,“no wonder the damn bird is always eating my birdie’s food!”   “birdie?”,8,eating,food,12
eat,"Katie, dp and my mom ate jello shots from our rainbow bag and eventually switched to shots of tequila with slices of lemon stuck in their teeth like a bad child's gag.",6,ate,shots,8
eat,well i gg eat sum dinner.,3,eat,dinner,5
eat,And they were eating hot dogs.,3,eating,dogs,5
eat,"So, yeah, not much else is going on in my life right now, so chicken is the highlight of my day (that and eating really good spaghetti.)",27,eating,spaghetti,30
eat,This is the first time i have not eaten breakfast there with my grandparents at the one near the indianapolis airport.,8,eaten,breakfast,9
eat,"so apparently, at walgreens, they are encouraging the practice many people attempt to leave in kindergarten, eating paste.",19,eating,paste,20
eat,How ironic is it that someone who is probably going to be the next tuna spokeswoman (insert perverted joke here) can now afford to eat filet every night?,26,eat,filet,27
eat,"I'd sip root beer and eat matt's chocolate chip cookies from grandma's famous glass cookie jar, and sing with harry caray during the 7th inning stretch.",6,eat,cookies,11
eat,"i am not a big fan of reality series either since the main premise is to imitate real life, but hey, who really lives with 20 other women competing for one man, or on a deserted island eating bugs, or who marries their sister's third husband who has survived a killer bee attack and given birth?",40,eating,bugs,41
eat,"It seems like night all day, and i'm eating way too much food from the craft services tables.",10,eating,food,14
eat,"If you take a can of nuts and dump them in your backyard, you'd better believe i'm gonna eat those nuts.",22,eat,nuts,24
eat,"Just so you don't get the wrong idea, eating nuts isn't all i do.",10,eating,nuts,11
eat,"You won't offend me if you assume that i eat nuts, because it's true.",10,eat,nuts,11
eat,"If, when i'm gone, you hear someone say, 'that danny, he was a good guy, but he didn't eat many nuts,' i insist you set them straight.",26,eat,nuts,28
eat,John and i just put on one of his stories while we're eating dinner and just laugh.,13,eating,dinner,14
eat,Ate grass.',0,Ate,grass,1
eat,emailalert=no&email=adgrant@indiana.edu&url=http://closeproximity.blogspot.com&name=proximity&bgcolor=003399&fcolor=ffffff&link=ffffcc&words=comments&title=comments &width=350&height=350'>    my boss was telling me that at sundance a  urllink documentary  debuted about a perfectly healthy guy who decided to eat mcdonalds 3 meals a day for 30 days.,44,eat,meals,47
eat,This table of women eating their taquitos let out the hugest yelps and belted the little pidgie in mid-air.,4,eating,taquitos,6
eat,"I'm still leery of the whole atkins fad, and i think exercise, avoiding caffeine, drinking lots of water, and eating balanced meals is the way to go.",24,eating,meals,26
eat,"From the guy at the art institute who was hellbent on getting us to eat dinner at bennigan's to the friendly-yet nonsensical guy on the el to mark, the lawyer who just had a baby, who chatted with us at the bar, everyone was really talkative and fun.",14,eat,dinner,15
eat,These can be things you've been eating a lot of this week either at home or at a restaurant.,7,eating,lot,9
eat,"Jon and i eat the same basic meals every week: tacos (my personal favorite), ravioli, salad and bread, frozen pizza, pasta...or we go out.",3,eat,meals,7
eat,"We kicked it on fisherman's wharf and watched the sea lions that have a fine colony there, saw alcatraz (but didn't take the tour), and ate a great sundae at the ghiradelli restaurant (nothing wrong with a 'restaurant' that only has chocolate treats on the menu).",31,ate,sundae,34
eat,"I love valentine's day because, significant other or not, it's a holiday that encourages eating lots of candy, so it's up there with halloween and easter for me.",18,eating,lots,19
eat,We get a cartoon scene with a witch who has a man eating vagina!,12,eating,vagina,13
eat,emailalert=no&email=adgrant@indiana.edu&url=http://closeproximity.blogspot.com&name=proximity&bgcolor=003399&fcolor=ffffff&link=ffffcc&words=comments&title=comments &width=350&height=350'>    here is a pinata for you to beat with a baseball bat and then eat lots of snacks that come out of it's stomach.,36,eat,lots,37
eat,"Now is my church, just this past sunday, our priest gave us a lecture about leaving early and coming late and then dropped the bomb: apparently some people in our church have not been eating their host at communion and have been leaving it in the pews and song books instead.",37,eating,host,39
eat,"emailalert=no&email=adgrant@indiana.edu&url=http://closeproximity.blogspot.com&name=proximity&bgcolor=003399&fcolor=ffffff&link=ffffcc&words=comments&title=comments &width=350&height=350'>   urllink ch.bmp  after bawling my eyes out from mike's departure this morning (that's right, he ditched alison to stay in chicago and hang with matt and me), i decided to eat a waffle and check the weather on tv.",59,eat,waffle,61
eat,What cute animals have you eaten ?,5,eaten,animals,2
eat,Now most of you know about my rule to never eat food from gas stations (unless prepackaged) and i considered breaking that rule just to get the free song...,10,eat,food,11
eat,I got many a laugh from imagining my cashier actually having to eat my chalupa if i did't enjoy it!,12,eat,chalupa,14
eat,"She eats mayonnaise by the spoonful from the jar as he encourages her to go for a walk, run up the stairs, do anything to shed the pounds.",1,eats,mayonnaise,2
eat,I was watching the today show this morning as i ate my nutritional breakfast of chocolate chip cookies and i got to wondering...why do all of those people wave like fools?,10,ate,breakfast,13
eat,"Not so warm and fuzzy is the story of the delaware student who  urllink ate an entire bag of mushrooms, stole a car and ended up lost 300 miles away in conneticut .",15,ate,bag,18
eat,"Lots of friends (yay aly) and psycho friends of my mom kickin it, playing weird games, and eating some tasty snacks.",21,eating,snacks,24
eat,"I have to admit that i was not skeptical in terms of eating the snack because a shell just doesn't seem, well, alive.",12,eating,snack,14
eat,Prolly eating-literally eating *wink*,4,eating,wink,6
eat,"Actually, i do eat dessert.",4,eat,dessert,5
eat,But i have been eating up the npr coverage of the democratic national convention.,4,eating,coverage,8
eat,"The panadol did some magic and before long i was eating dinner and we were playing board games - entertainment without tv, reminds you of black and white days, no?",10,eating,dinner,11
eat,Portgas d. ace...he ate the mera mera fruit and can extract and control fire at will.,5,ate,fruit,9
eat,Half a dozen or so big turtles are in shin-deep water eating green stuff off the rocks in the water.,13,eating,stuff,15
eat,The whole family ate popcorn and watched the neverending story last night.,3,ate,popcorn,4
eat,The whole family ate popcorn and watched the neverending story last night.,3,ate,popcorn,4
eat,"Mort also perches on the dock in front of the family cottage in while we eat dinner in the summertime, looking out over mackinac bay.",15,eat,dinner,16
eat,"It roughly translates into:   'addison i want you to sit with your bottom on that seat until we are finished eating our supper.'  (to which my son, inevitably concerned with the theoretical endlessness of the unmarked future, asks: but, daddy.",23,eating,supper,25
eat,Karen ate each bite enjoying it.,1,ate,bite,3
eat,Thomas ate his dinner fiercely.,1,ate,dinner,3
eat,"Not like we’re embarrassed that we eat the food that makes the stains, or drink the coffee that dripped on our shirts.",7,eat,food,9
eat,A white van had pulled up next to me during the stop and go rush hour traffic and had been enjoying watching  me eat my ice cream as much as i was enjoying eating it.,24,eat,cream,27
eat,Can't a girl eat ice cream in peace?,4,eat,cream,6
eat,Yes or no 1. eat a bug?:,5,eat,bug,7
eat,"Then round twelve we went bakk home, got online, watched culess, got bakk online and then ate a sanwich and then took marlena home!",19,ate,sanwich,21
eat,I felt guilty for eating a big ass whopper.,4,eating,whopper,8
eat,we ate at green fields...a brazilian restaurant.,1,ate,restaurant,8
eat,i felt sorry for andy's cousin cuz i guess she doesn't eat beef...,13,eat,beef,14
eat,"so, he did and since he didn't eat dinner, he ate some of my chilli.",9,eat,dinner,10
eat,"however, my meal would've been better if i could eat some rice.",11,eat,rice,13
eat,we ended up eating dinner at disney california!,3,eating,dinner,4
eat,"at one point, he got spoiled and he wouldn't eat his food unless it had barbecue sauce on it.",11,eat,food,13
eat,i figured that i wouldn't enjoy the food since we couldn't eat meat that day!,13,eat,meat,14
eat,"yesterday, i ended up eating rice!",5,eating,rice,6
eat,andy is still going strong with not eating meat during lent.,7,eating,meat,8
eat,"that turned me on cuz i like eating certain things, ie. sausages with syrup!",7,eating,things,9
eat,"so, i was getting ready to leave and i went into the lunch room since my coworkers were eating lunch at the time.",19,eating,lunch,20
eat,my fish is eating feeder goldfish now!  yuck!,3,eating,goldfish,5
eat,"we had breakfast, went to the pool (for like 3 hours), ate lunch, watched tv, watched freaky friday, went to the pool, took a bubble bath, eat dinner, watch tv, and now they're finally sleeping!",15,ate,lunch,16
eat,"we had breakfast, went to the pool (for like 3 hours), ate lunch, watched tv, watched freaky friday, went to the pool, took a bubble bath, eat dinner, watch tv, and now they're finally sleeping!",35,eat,dinner,36
eat,the freakin' atm ate my card!,4,ate,card,6
eat,andy and i just ate the left overs for lunch.,4,ate,overs,7
eat,after he ate his breakfast.,2,ate,breakfast,4
eat,"coach was freakin' eating up the nachos!  from the looks of it, she ate a lot!",4,eating,nachos,7
eat,"coach was freakin' eating up the nachos!  from the looks of it, she ate a lot!",17,ate,lot,19
eat,i probably ate only half of it!,2,ate,half,4
eat,i only ate about half of it.,2,ate,half,4
eat,I was eating candy and singing!,2,eating,candy,3
