lemma (V),sentence,verb index,verb text,dobj,dobj index
eat,i was wondering is the math exam paper a a'level one...so damn farking hard...after the test slack around and went to eat my dinner at henderson hawker centre wit my friends...went back to skool's library at 6:35pm to contiune studying till 8:50pm like tt...tt yuting keep li xiao,25,eat,dinner,27
eat,cb doctor gave me so many tablets to eat...tablets suck...so after eating medicine went back to sleep at 3 plus hiphoppig call me to go gym...,15,eating,medicine,16
eat,i don even haf to strength to walk to my own toilet still ask me go gym...eat noodles for my dinner yuck it taste suck...after eating three rounds of medicine,18,eat,noodles,19
eat,i don even haf to strength to walk to my own toilet still ask me go gym...eat noodles for my dinner yuck it taste suck...after eating three rounds of medicine,29,eating,rounds,31
eat,so sad 2day i was coughing all the way so noisy sure got pissed ppl off one..sorri guys just bear wit me...haf a english mock test 2day and didnt realli do my best after which slack around in skool and went to tbp to haf my dinner..ate my dinner wit a big group of friends...yea..,53,ate,dinner,55
eat,i am feeling so tired now...yawnzzz..went to my father stall to help out until 4 plus then went home to get changed to get ready to meet carlos...play pool till wan 9 o'clock lioaz then mojojo ask me wan accompany him go eat dinner or not then me and carlos went to tiong bahrua and went for him to arrived...by the time he arrived it was already 10 plus...,48,eat,dinner,49
eat,"the blog craze is becoming like as unto the atkins diet, exept that  a) blogging, to me, seems cooler than not eating bread b) see reason a.   beginning a blog now, i feel a bit like i felt when i began to read the lord of the rings trilogy.",26,eating,b,28
eat,"That, and there's very little i can eat or drink while i'm there... nothing but bottled water (even to brush my teeth), no fresh fruit or vegetables unless boiled or peeled, no raw meat or seafood (right, because i was going to eat raw meat anyway...",52,eat,meat,54
eat,I think about eating the deadly nightshade berries from the bushes beside the path.,3,eating,berries,7
eat,"Scorpio, november 14,  d you eat the stems of broccoli?",8,eat,stems,10
eat,The vivid tulips eat my oxygen.,3,eat,oxygen,5
eat,"and i just made sean eat the rest of mine...and then the applebee's people all came out and sang to sama, and we all went back to samantha's house.",5,eat,rest,7
eat,Jimmy eat world--,1,eat,world--,2
eat,"friends {aka sanity} family {ack!} eat/sleep  {heh, heh} liturgy planning committee at school {where do i find tracy haden?????}",10,eat,committee,21
eat,"I shouldn't have eaten dinner, i knew i wasn't hungry.",4,eaten,dinner,5
eat,"My father had already eaten breakfast, and he was out in the fields.",4,eaten,breakfast,5
eat,"fried tofu, noodles, and onions... mmm} then sean made me eat ice cream, and as full as i thought  i  was...  it  tasted soo  good.",14,eat,cream,16
eat,When i actually eat food at winsteads i order a fried egg sandwich with tomato.,3,eat,food,4
eat,{again} and we ate lots and lots and lots of chocolate cake.,5,ate,lots,6
eat,[6:42 pm]:  or maybe not   i wrote this on tuesday:  i'm eating a bagel... again.,19,eating,bagel,21
eat,"and i ate more chocolate than i ever thought possible, ha ha.",2,ate,chocolate,4
eat,"Then i came home, my family ate dinner without me.",7,ate,dinner,8
eat,Antony trakas can just eat his heart out. 20 days.,4,eat,heart,6
eat,"This led to people living on the beach and paying $400/month - where as landlords expenses were exceeding that inflationary factor, thereby eating into the spare cash flow the property generated.",26,eating,property,33
eat,"The dialogue goes something like this:  little girl (note, not little boy): daddy, why do we eat cheerios?",22,eat,cheerios,23
eat,"Lg: did you always eat stuff that was bad for your heart, daddy?",5,eat,stuff,6
eat,Eat your heart out.,0,Eat,heart,2
eat,"Every single comic starts out the same: garfield sits around being fat, he eats all the food, and his ambiguously gay owner yells at him: the cat eats food.",15,eats,food,18
eat,"Every single comic starts out the same: garfield sits around being fat, he eats all the food, and his ambiguously gay owner yells at him: the cat eats food.",31,eats,food,32
eat,"I dunno, but i'm drinking h2o and eating bread to hedge.",9,eating,bread,10
eat,4) statistics show that more than 75 % of violent crimes are committed within 24 hours of eating bread !,18,eating,bread,19
eat,The average person eats more bread than that in one month !,3,eats,bread,5
eat,Scientists have now uncovered alarming evidence that 100% of the people who eat bread will eventually die !,13,eat,bread,14
eat,11) 96 % of cancer victims eventually admit that they've eaten bread !,12,eaten,bread,13
eat,"If you're wondering, w.t.f. is fat kid talking about now, he's eaten one too many crullers or something,  this all in response to  email pleas (see below) from a co-worker, begging for me (and all my co-workers) to give money to the 'million mom march'",16,eaten,crullers,20
eat,"If you're wondering, w.t.f. is fat kid talking about now, he's eaten one too many crullers or something,  this all in response to  email pleas (see below) from a co-worker, begging for me (and all my co-workers) to give money to the 'million mom march'",16,eaten,workers,52
eat,we ate a lot and talked about going to see open water.,1,ate,lot,3
eat,"I'm obsessed... so?  john mayer was really sexy too, but he tried eating the microphone.",17,eating,microphone,19
eat,It's eating my ribcage out to write this.,2,eating,ribcage,4
eat,"Olive garden, where i can eat exactly one thing on the menu, the chicken caesar salad, and watch the rest of my table feed on sumptuous-smelling breadsticks.",6,eat,thing,9
eat,"If you are dieting, cake means watching other people eat cake.",10,eat,cake,11
eat,The experience  or eating a sushi dinner.,4,eating,dinner,7
eat,"But there’s a larger, easier, more informal movement that fit city is pushing against, which will probably emerge triumphant at the end of the day, and that’s the citywide drive to eat a lot of fattening food, often in public.",37,eat,lot,39
eat,"Actually i really don't think i'm eating that much, i'm just eating a lot of junk food and because this is the longest period of time i haven't been in a sport or exercising for like 5 years it feels like i'm getting fatter, but technically i'm really not.",15,eating,lot,17
eat,I'm eating an apple as i type.,2,eating,apple,4
eat,I'm proud to say that i ate 3 times as much as most people on the team.,7,ate,people,14
eat,Funny to because at every pasta party stick and kathryn always go back to how i had eaten 8 pieces of lasaguna at a pasta party before and how i had eaten a whole cheese bread pizza from papa john's.,17,eaten,pieces,19
eat,Funny to because at every pasta party stick and kathryn always go back to how i had eaten 8 pieces of lasaguna at a pasta party before and how i had eaten a whole cheese bread pizza from papa john's.,31,eaten,pizza,36
eat,Bad idea to eat chili at wendy's before a game : /   i'm tierd.....,3,eat,chili,4
eat,And in the morning were eating waffles!,5,eating,waffles,6
eat,"5 things you do every morning  - groan, sleep for 'just 5 more minutes', stretch, pray, eat a bowl of cereal.",23,eat,bowl,25
eat,"The weather was perfect, the water was warm, we ate amazing food every day, and we were all getting along.",11,ate,food,13
eat,"Some people drank too much, my brother did a hilarious dance to 'get' the garter, my mom complained about the photographer eating dinner at one of the guest tables, etc, etc.",25,eating,dinner,26
eat,"You might think its an adaptation of our familys last name  but really, its because rocky eats rocks.",18,eats,rocks,19
eat,"I just ate part of a 'fast break' candy bar, and it was too sweet for me.",2,ate,part,3
eat,"In other news, i just ate a packet of sour skittles and am jumping around all over the place.",6,ate,packet,8
eat,The woman with the lucky job of answering the phones there calmly explained to me that the mouse will eat the poison put out by the exterminator and then leave your apartment to die.,19,eat,poison,21
eat,"To further complicate all this, ive seen too many tom & jerry, speedy gonzales, and even micky mouse cartoons to begin to think that its a done deal that the mouse will eat the poison, no matter how enticing.",36,eat,poison,38
eat,This entails trying to hide chocolate from him (last week grandfather ate an entire bag of hersey's minibars) and taking the phone away (a couple days ago he called 911 and the cops came to the house - maybe he called because he ran out of chocolate?).,12,ate,bag,15
eat,It's like they've never had cake before...or eaten befoe or something.,11,eaten,befoe,12
eat,"Not only am i never eating asian food again, but my days of delicious diet coke are behind me.",5,eating,food,7
eat,"When i'm here in ny by myself, i don't have many options for things to do: i either go back to my hotel room and watch way too much tv and eat a bag of pirate's booty (my favorite), or i go wander around until the stores close and spend money.",35,eat,bag,37
eat,"I can't wait to eat  real  fish and chips, watch the big breakfast, go to some good indian restaurants, attend an evensong at westminster abbey, eat belgian chocolate, and talk to many british men.",5,eat,fish,9
eat,"I can't wait to eat  real  fish and chips, watch the big breakfast, go to some good indian restaurants, attend an evensong at westminster abbey, eat belgian chocolate, and talk to many british men.",32,eat,chocolate,34
eat,I just spent my lunch time in the company-provided break room trying to peacefully eat my lunch and read my book.,16,eat,lunch,18
eat,"I highly recommend the series of unfortunate events series  6.  eat orange tic tacs like candy, instead of using them as breath mints  7.",13,eat,tacs,16
eat,You know you're pathetically single when you eat bologna sandwiches for dinner.,8,eat,sandwiches,10
eat,Have you been eating the taffy again?,3,eating,taffy,5
eat,Some highlights: -- eating king crab legs and a bottle of wine...then going to a hole-in-the-wall bar with great u2 albums on the jukebox.,4,eating,legs,7
eat,"I have always been a big fan of the traditional special k  growing up, my grandma ate a bowl everyday while preaching your mantra to anyone who would listen: if you can pinch an inch  so with the addition of the red berries, not only am i keeping grandmas legacy alive, but im also enjoying the sweetness the new berries have to offer.",18,ate,bowl,20
eat,"Djs, thank you for eating the rest of the sausages...and taking them down.",5,eating,rest,7
eat,"A friend is eating cake at her workplace, because it's her birthday on sunday and they're celebrating today.",3,eating,cake,4
eat,I was hungover today too - plus generally feeling gross after eating brownies and cookies and hummus and pita and chips and cheese and lime chips and baked cheesy chips and bread and artichoke dip.,11,eating,brownies,12
eat,"A lot of people like to eat frosting, except me.",6,eat,frosting,7
eat,"Weren't you cheered to see the ironworkers sitting on an i-beam dangling from a cable, in a row, like starlings, eating lunch, maybe baloney on white with flourescent mustard?",26,eating,lunch,27
eat,"This is a lot of pressure - i mean, i already have to stop eating meat on fridays, and then there's the whole easter vigil thing on holy saturday which is just about the longest mass in existence.",15,eating,meat,16
eat,"So i'll pray for world peace, and i'll even abstain from eating meat, but no eating between meals is going to be tough...especially considering my mom just gave me 5 boxes of girl scout cookies and they're sitting on my desk right now.",14,eating,meat,15
eat,"Its cheap, you get to eat tons and tons of good food, and you get to sit in the sunshine.",6,eat,tons,7
eat,"I ate escargot for the first time in my life, and was introduced to guavaberry rum  which is really tasty in guavaberry coladas.",1,ate,escargot,2
eat,"Rosemary consumer affairs department   on the bottom of rosemary's very unremarkable retort, there was a push to remember to eat breakfast...   national school breakfast week is the perfect time to remind parents of the importance of eating a good breakfast.",22,eat,breakfast,23
eat,"Rosemary consumer affairs department   on the bottom of rosemary's very unremarkable retort, there was a push to remember to eat breakfast...   national school breakfast week is the perfect time to remind parents of the importance of eating a good breakfast.",41,eating,breakfast,44
eat,Findings from studies conducted by nutrition research organizations continue to support the fact that children who eat breakfast do better academically and behave better in school than those who do not.,16,eat,breakfast,17
eat,The key reason...not eating breakfast means that blood sugar levels remain too low to allow for proper concentration.,5,eating,breakfast,6
eat,My brother always ate breakfast when we were growing up and that never made him 'behave better.',3,ate,breakfast,4
eat,Duf makes a bid for eternal hell fire:   ...then she should have sang about eating a ham sandwich or somethin'!,17,eating,sandwich,20
eat,I'm eating papaya right now.,2,eating,papaya,3
eat,They can eat a dick all the way up.,2,eat,dick,4
eat,"Finally, the evening was concluded by  eating pizza at dulonos .",8,eating,pizza,9
eat,"We'll be eating mouthwatering hotdogs, delicious chips, and savory soft drinks.",3,eating,hotdogs,5
eat,"The next night, after the yo la tengo show (killer, btw), we were innocently eating a nice meal at clarke's diner, when our waitress came over with 2 glasses of milk.",19,eating,meal,22
eat,(too busy eating my churro and drinking hot chocolate.,3,eating,churro,5
eat,"If you still listen to this new liz phair cd even a year from now, i will eat her nasty underwear and say it's my 'favorite.'",18,eat,underwear,21
eat,"Before i hit the theatre, dirty and i ate a burrito.",9,ate,burrito,11
eat,"Third, when i go to a restaurant, i usually eat the same thing.",11,eat,thing,14
eat,"I know enough not to embarass myself at a business dinner, but i could also use some culinary refinements (ex:  we were at savories in stillwater last weekend, and when they brought out the figs with candied almonds and creamed gorgonzola as a pre-meal palate exciter, not only did i think it was tiny limes with whipped cream, but i didn't know if i should eat the entire fig or what...help!)",75,eat,fig,78
eat,I couldn't eat cereal for a couple days because i couldn't find my bowls.,3,eat,cereal,4
eat,I went to a brand new all-you-can-eat sushi/teriyaki restaurant last night.,12,eat,restaurant,16
eat,While tinye eats her pb sandwich...   ...i will eat crow.,2,eats,sandwich,5
eat,While tinye eats her pb sandwich...   ...i will eat crow.,11,eat,crow,12
eat,My little brother was not pleased about eating his slice of spinach quiche next to some viking fans eating double cheeseburgers and fresh corn on the cob boiled in a garbage can (now that was hardcore).,7,eating,slice,9
eat,My little brother was not pleased about eating his slice of spinach quiche next to some viking fans eating double cheeseburgers and fresh corn on the cob boiled in a garbage can (now that was hardcore).,7,eating,quiche,12
eat,My little brother was not pleased about eating his slice of spinach quiche next to some viking fans eating double cheeseburgers and fresh corn on the cob boiled in a garbage can (now that was hardcore).,18,eating,cheeseburgers,20
eat,"My mother will not eat a hot dog, no matter what - she had to live on them when she was a poor college student, and she maxed out.",4,eat,dog,7
eat,Do i go and eat chicken wings or do i head back to the station and possibly help save a life?,4,eat,wings,6
eat,Eating mac & cheese while watching a rented movie.,0,Eating,mac,1
eat,when i eat mussels.,2,eat,mussels,3
eat,"Here goes:  a. white n' creamy  - i won't eat anything a white and creamy consistency, which includes: sour cream, mayonaisse, cottage cheese, ranch dressing, cream cheese etc.",14,eat,consistency,20
eat,"People spend all kinds of money trying to keep athlete's foot at bay, yet people are willing to eat 'shrooms.",20,eat,shrooms,22
eat,Since when does eating maggots or worms from the water sound appetizing?,3,eating,maggots,4
eat,"Few people talk about when your child finally learns how to open the refrigerator (no kidding, tinye has eaten about 15 clementines in the past 3 days).",20,eaten,clementines,23
eat,"She married a vegetarian, but one who does not care if she eats veal everyday.",13,eats,veal,14
eat,"The dead of winter sucks because you can't go outside for even 5 minutes, and all i want to do is sleep and eat cake and cookies (yes, cake and cookies...in winter i have an unbelievable craving for both).",25,eat,cake,26
eat,"About half way there, id stop, have a seat on the sidewalk, and eat my lunchbox leftovers.",17,eat,leftovers,20
eat,"I was not allowed to eat pre-sweetened cereal, but i was allowed to sweeten my cereal.",5,eat,cereal,9
eat,I would always eat a thing of yogurt for a snack (i'm a creature of habit),3,eat,thing,5
eat,The rancher replied:  'enough to eat all the grass.,8,eat,grass,11
eat,"The festival was kind of dead since willie nelson (the headliner for the fest) cancelled at the last minute, but we stayed anyway and played glow-in-the-dark frisbee and stopped at some political and environmental booths and drank rolling rock and ate jamaican jerk chicken.",49,ate,chicken,52
eat,We all got burgers but ever since i had a colossal burger it makes me nauseas and i cant eat their burgers.,20,eat,burgers,22
eat,And becca has offered an invitation to erica and i to eat lunch in mr. millers room with her and her friends.,11,eat,lunch,12
eat,And worf tends to slobber a lot when he eats the fresh catnip.,9,eats,catnip,12
eat,"Meanwhile, and back to the catnip, i can grow that legally, even though it is a drug for my cats, and i myself have been known to eat a leaf to relieve the occasional stomach ache (and it does the trick for me) with the added side effect of causing me a bit of drowsiness, so if i really needed it i suppose i could use it to help me to sleep at night, which is an ongoing problem (not sleeping).",31,eat,leaf,33
eat,"so,what do i think about...... about food, and why i eat or don't eat what   i can eat pork liver, but not beef liver because it smells pissy to my.",23,eat,liver,25
eat,"My husband likes to eat scrambled eggs with ketchup on them, yucky!",4,eat,eggs,6
eat,"I can eat ketchup, but it is not my favorite thing.",2,eat,ketchup,3
eat,"I love to eat bread with peanut butter along with a bowl of chili, and i do know some other people who like the same.",3,eat,bread,4
eat,"I know someone that won't eat anything that doesn't 'look good', i eat most things, looking good or not, and i never refuse free food.",17,eat,things,19
eat,"I also know someone that won't eat mushrooms because they grow in manure, if she only knew how many things are grown in manure, she would probably starve to death.",7,eat,mushrooms,8
eat,"I believe she drinks, and most things with alcohol are the result of yeast eating the sugars, the alcohol is like the yeast's excrement, a by product of the yeast (little living creatures) after it has digested the sugars, it's waste, so to speak.",15,eating,sugars,17
eat,"And i don't eat salt on much of anything, because i feel that you can't taste what you are eating if you use salt.",4,eat,salt,5
eat,why but my legs feel strangely weak...must that fall i had or maybe after eating 'kfc'...man...feel so lethargic..,16,eating,man,20
eat,"people that came were leroy, cheepong, thomas, isaac, yanming, aloysius, guangwei, zhaoyi, i and another guy who i don't know his name...while everyone was eating burger king, leroy and i patronised old chang kee (or old chunky)...after eating, we went to neighbourhood 700+ to play soccer again....",35,eating,king,37
eat,"Eating food on the mrt is so kinda' dangerous that it can even slap you with a five hundred dollar fine, which is so kinda' stupid",0,Eating,food,1
eat,"My boyfriend and all my friends are out playing tennis right now, having a good time and all i'm doing is eating yesterday's leftover bread for dinner and staring at my computer screen.",23,eating,bread,27
eat,"Eat dust, satan!",0,Eat,dust,1
eat,"Finally, god ruins his diet too, proclaiming, 'dust shall you eat all the days of your life.'",14,eat,days,17
eat,it was her mom's birthday so we ate cake!,8,ate,cake,9
eat,It was fun we basically just talked and sang happy birthday to her mom and ate cake!,15,ate,cake,16
eat,"Thus, i ate breakfast late.",3,ate,breakfast,4
eat,yet it was kinda pointless in many ways i think manda got bored since she was eating the whole time,16,eating,time,19
eat,soo we ate food with them,2,ate,food,3
eat,"Me: oh sad, i heard on the radio that a coyote ate a daschund!!!",13,ate,daschund,15
eat,"Well of course after that gester and after dealing with my sick daughter all day shopping i had all i could take of the day and promptly recieved my change and replied to her, 'you know yo can eat shit!!'.",40,eat,shit,41
eat,"Anyway, i found this really sweet quote on the net:   a father is someone that  holds your hand at the fair makes sure you do what your mother says holds back your hair when you are sick brushes that hair when it is tangled because mother is too busy lets you eat ice cream for breakfeast  but only when mother is away he walks you down the aisle and tells you everythings gonna be ok   -unknown",55,eat,cream,57
eat,"Also, she stated that she had eaten a lot of candy.",7,eaten,lot,9
eat,We ate breakfast and here i am right now writing.,1,ate,breakfast,2
eat,"Yes, i ate indian food.",3,ate,food,5
eat,"Also, we ate potato pancakes and 'cupcakes'.",3,ate,pancakes,5
eat,"So while arranging the song b, ash, robin and charles wrote, descriptive, we paused to eat some great wall and watch the season finale of 24, which was really good.",19,eat,wall,22
eat,"And of course, as much time as possible was spent my 5 year old nephew, who becoming more of a clone of my girlfriend every day, just as my small cousin has become a star wars loving benihana eating clone of me.",41,eating,clone,42
eat,"About two months ago, my distant neighbors decided to eat dinner in their lingerie.",10,eat,dinner,11
eat,"There is literally never a moment of rest this month as i woke up at 4am, got on a 7am plane, flew to ny, walked in the door, kissed irene hello, ate some pluck and then ran off to see saintface in brooklyn at my favourite venue southpaw.",38,ate,pluck,40
eat,"Yes, i did make up for it by watching the awesome iron man match on raw while eating pizza.",18,eating,pizza,19
eat,and i couldn't eat chicken for about a month.,4,eat,chicken,5
eat,This time she was the one eating all the cookies.,6,eating,cookies,9
eat,Gave her the finger and went back to eating our pizza.,8,eating,pizza,10
eat,Then eat some popcorn.,1,eat,popcorn,3
eat,(he's a teacher) 'i'm just going to sit in the car and test tobacco and eat tacos',20,eat,tacos,21
eat,Come home and eat lunch meat.,3,eat,meat,5
eat,How about when i am shopping in the grocery store and women push me out of their way because there is a sale on beef for .90 cents per pound (don't these people know it's bad to eat meat and even worse to be rude?),40,eat,meat,41
eat,"Days when all i want to do is lie in bed and cry, eat ice cream and tell everyone to fuck off...who knows.",14,eat,cream,16
eat,"Today has been a very disastrous day: as i've written in the last post, yesterday i come back home at 4:15h, and i had eaten pizza; then, in the morning, i had something like a stomach-ache, but it was worse.",28,eaten,pizza,29
eat,"At least, our work has given us its fruits... after finishing it, the musicians have gone to a restaurant near the theatre, where i've eaten a 4 chesed pizza (yes, my favourite food!) and drunk 'sangría', a drink made especially of wine, that has citrus fruits and some citrus fruits' juice.",29,eaten,pizza,33
eat,"Like, 'an extreme longing for cake.'  a stranger would be all 'that fucker eats cake.",19,eats,cake,20
eat,"Bert: well, ernie, i wish you wouldn't eat cookies in the   damn bed  .",11,eat,cookies,12
eat,"Ate food, or in my case drink rndm not rite tastin mango pearl tea.",0,Ate,food,1
eat,I warn those that go that is a damned effcient waste of time and about as coherent as eating a pair of boots when agitated.,18,eating,pair,20
eat,"amongst 'wig' discussions, kiz decided to check out the guyz in the class, we ate phoebe's crackers, looked up  wig  in my english-jap dictionary ---  katsura , and attempted to understand what shyam was teaching us.",18,ate,crackers,21
eat,"listen to one 5 minute english speech, invade a yr 9 classroom so we could watch their movie and eat their chocolate.",20,eat,chocolate,22
eat,Heres a new song thatll eat up some space  i heard you're doing ok,6,eat,space,9
eat,attempts to eat lettuce all day failing.,2,eat,lettuce,3
eat,love you italo.... let me go to zion and eat olives...do they have magnolia trees there?,10,eat,olives,11
eat,"if only i could eat chocolate, everything would be better.",4,eat,chocolate,5
eat,"Some while back i met a woman in southern california (i name no names) who revealed that she had not one but two yalie sons who had come back home after graduation to a new life, not quite what she expected, of getting up late, eating bizarre amounts of cereal, and watching reruns on tv; and who, when pressed about what they might want to go out and do, glared the unspoken words: don't go there.",50,eating,amounts,52
